	Summary	Job Title	Date	Overall Rating	Pros	Cons
0	Awesome	 Account Health Support Specialist	8 Mar 2023	5.0	Great team, awesome pantry, nice scenery.	No birthday offs, no bonuses.
1	meh	 Account Health Specialist	26 Feb 2023	2.0	Good hiring and onboarding process	Micro management from mangers Unable to see purpose of certain tasks
2	Not bad	 Warehouse Associate	24 Feb 2023	3.0	Multi cultural and respectful senior management	Co workers can be toxic sometimes
3	Supercharged learning for early career	 Risk Manager	17 Feb 2023	5.0	- Learn from the leaders that enable you to grow by challenging your mental models and how you approach problems - You get a fair degree of flexibility in developing solutions for business problems that you identified as priority to work on	- As you progress upwards, politics will start becoming more obvious. Managers do a good job of shielding their functional roles from dealing with them directly, however this can be a risk if you are not well equipped to handle it as you go through promotions - Depending on the maturity of your country's business unit, even if you have flexibility in building solutions, you will have a fair bit of compliance to worry about with Global standards established in the NA region. This can be a dealbreaker for some people as certain business problems require customization for different regions, hence becoming a blocker instead of an enabler.
4	Good for short term	 Warehouse Associate	15 Feb 2023	3.0	Flexible, decent pay for warehouse job	Alot of walking, long hours and very boring job.
5	Work life balance	 Account Specialist	13 Feb 2023	4.0	- Learn a lot, a good working environment. - Nice Office	-Micromanagement - Over work and no OT pay.
6	Amz	 Team Lead	13 Feb 2023	4.0	Good working schedule and flexibility to transfer shifts	Low compensation and poor packages. Overpromise from upper management.
7	Normal Part time job	 Fulfillment Associate	13 Feb 2023	3.0	Think positively you can get healthy by exercising	Put a toil on your knee
8	A very helpful and intact team	 SMB Sales Representative	7 Feb 2023	4.0	- great support from leaders, colleagues and teammates - tightly knitted and one team goal up to the country level - best sign in bonus and compensation - amazing insurance benefits - great service and customer obsessed - long term goals	- spends a great deal of time putting in paper, narratives plans and execution reports - double hats
9	.	 Warehouse Associate	26 Jan 2023	5.0	very good place to work	some leaders are quite toxic
10	Better than most packing jobs	 Warehouse Packer	25 Jan 2023	3.0	Air conditioned warehouse with better welfare than other companies	Job nature still mundane and not recommended to do long term
11	Only worth your time if you have a good boss.	 Account Manager	20 Jan 2023	3.0	- Strong culture - Challenging work - Good Exposure	- If you have a bad boss, you will not be able to promote - Your team can become really toxic, if the hiring bar is lowered - Leadership keeps changing and they don't really know what they are doing.
12	Temporary Job	 Picker/Packer	14 Jan 2023	3.0	Simple and easy No need to socialise Easy to get shifts	Boring and long with the new requirement hours 10 hours is too long and the work load is somewhat unbalanced Forced to be doing anything and everything with every second of work
13	Ok	 Account Manager	4 Jan 2023	5.0	Decent salary Flexible work arrangement	"Benefits could be improved, ""frugality"" is not a good leadership principle to have"
14	AWSome Company to work for!	 Senior Solutions Architect	3 Jan 2023	5.0	* Go-getter culture permeates the entire company * Extremely customer focused - you will learn to put the customer at the center of all our thought * Most leaders live by the Amazon Leadership Principles most of the time * Fun work culture	* Work can get to you if you do not prioritize and filter work * While technical eminence is part of your KPI - it usually comes at the cost of a lot of after work hour effort * Direct culture - be prepared to hear blunt feedback - but it is not meant in a negative way
15	Work life	 Associate Vendor Manager	2 Jan 2023	5.0	Very good work-lift balance, people are smart and friendly.	Too much ad-hoc and last min work request.
16	Great culture but a Lack of Manpower	 Internship	28 Dec 2022	4.0	A talented team and a great culture as expected in a tech company.	With a lack of manpower, I find many holding multiple roles and it could be overbearing at times. One has to know how to prioritize and find balance in work and play.
17	AVS/SVS/CATEGORY SPECIALIST (DO NOT APPLY) singapore	 Brand Specialist SVS	20 Dec 2022	1.0	able to learn about Amazon best practices from overseas	Worst job scope, do not apply. Multiple vendor managers who are unclear and do not take ownership of their own Brand/category. Convinced brand to pay for a head count in Amazon to focus on certain growth pillar however most VMs exploit the headcount to handle all task related to that vendor. Amazon has great success in the continental countries however they not able to localise (south east Asia) to local e-commerce landscape.
18	3 months in	 Sales Leader	19 Dec 2022	4.0	Great culture, clear values and strong principles that the company actually lives by, high level of innovation. Good focus on long term as opposed to short term.	"They are right when they talk about a ""particular culture"" it may not be for everyone, you need to trust the process and not fight it. Need to be prepared manage your own work load other wise you will get consumed."
19	Flat organizational structure, amazing company culture	 Mechanical Engineer	19 Dec 2022	5.0	great platform to get exposure to the the most advanced data center technology, various types of project	fast pace in working, customer-centric based on fast response of the Amazoniars.
20	Nice place to work	 TPM II	18 Dec 2022	4.0	Nice senior management. Freedom of work	No defined KRA. For promotion have to do something out of your daily work.
21	It’s really always day 1	 Account Health Support Specialist	5 Dec 2022	3.0	You will be trained to manage ambiguity.	Frugality , no bonus no AWS SOP can changes too often, can see almost weekly changes Change timing to your working hours too, without much negotiation
22	Great start-up culture for someone who likes to own and pioneer	 Senior Program Manager	27 Nov 2022	4.0	Best Day 1 Culture Collaborative Great teammates Competitive pay	High reliance on US tech Not as employee friendly compared to other Big Tech
23	Transportation Analyst	 Transportation Analyst	22 Nov 2022	5.0	Great culture and perks, super smart teammates.	Downside is data is not exactly clean
24	Ok but not recommended for an intern	 Senior Program Manager Intern	17 Nov 2022	3.0	Benefits Compensation Brand name Some really smart people	Unsupportive colleagues Poor data management Everyone is overworked Most people don't care enough
25	Culture	 Onboarding Specialist	16 Nov 2022	4.0	The way they work, flexible, meetings, doc writing. most org should follow amazon style	Everything is based on LP. Live and die by the LP
26	Best Employer	 Anonymous Employee	2 Nov 2022	5.0	- Very inclusive - Cares for employees - Offers good compensation	- Must be willing to relocate
27	Opertion Specilist	 Operation Specialist	1 Nov 2022	4.0	overall i would say everyone are very Friendly	Growth a bit slow overall.
28	Good for learning, Bad for work life balance	 Program Manager	30 Oct 2022	3.0	You get to learn from really smart people in a minimally political environment	You hardly can rest because there's just so much you have to do beyond working hours
29	Good place to work	 Senior Program Manager	30 Oct 2022	4.0	Ownership Ability to take risks Impactful work Good Pay WFH	Teams/stakeholders might be just too busy culture of self-discovery
30	Experience working there	 Recruitment Coordinator	26 Oct 2022	5.0	Great culture Great team Great setup	High volume and high paced.
31	Na	 Vendor	16 Oct 2022	3.0	Nice drinks and nice environment	Too messy in term of organization
32	Can be great if you are okay with Contact Center environment	 Account Health Support Specialist	16 Oct 2022	4.0	Great people. Seriously, I met best managers and coworkers and leaders here. Everyone is willing to help you and sometimes your colleagues make it okay when you had a tough day at work.	It's like they need you to be always doing something. On top of your usual work handling tasks, you will get pressured to taking side projects if you wish to step upward. That can be expected but even if you drive yourself chances of getting promoted can be quite slim. Also, not enough perks/benefits. They do not have extra flexi benefits to spend and do not even have lucky draw at the end of the year or something. Even when they do site wide events the winner gets like $30 reward. No iphone 14 :)
33	Good company	 Senior Consultant	14 Oct 2022	3.0	Good brand .And improvement for your career.	Lower salary comparing with other FLAG companys
34	nice	 Google Ads Specialist	11 Oct 2022	4.0	good food and nice office	bad pay not great team
35	Go for it only if you don't need private life	 Senior Vendor Manager	6 Oct 2022	1.0	Office location is in CBD	"- No work life balance
- No human resource in the name of ""frugality""
- Low salary compared to Google/Meta/Apple"
36	Fulfillingly demanding	 Associate Vendor Manager	5 Oct 2022	5.0	Amazing welcoming community, diverse background, endless learning resources.	It's a contract role and the potential for conversion to permanent position is uncertain; therefore struggle to feel connected to the company, people and work.
37	Good culture	 Customer Service	30 Sep 2022	5.0	Learn from many talented seniors	Every day is day one
38	Review	 Technical Support	25 Sep 2022	5.0	Awesome Day1 experience, whole new work Day1 culture which is different from other mnc, great office environment	awsome good pantry that will make you fat =))
39	Good benefit	 Account Specialist	21 Sep 2022	4.0	Good colleague and good benefit	Can’t think of it yet
40	Great Culture and Benefit	 Community Marketing Manager	19 Sep 2022	5.0	The leadership principle culture is amazing and all leader really breathe and live with that. One of my favourite LP is disagree and commit. The benefit also amazing and very generous, it's weird feeling when other tech company is hiring freeze in 2022 and layoff but Amazon still hiring and thrive for growth.	Complicated system and not fluid with the process. Since Amazon already a huge company, there's WIKI and training for EVERYTHING. You will be overwhelmed with the number of training, workshop, and onboarding items on your embark. But in the end it will help you, but it's not for everyone. Amazon is a very peculiar company.
41	Research scientist intern	 Research Scientist	14 Sep 2022	5.0	It's a chill place to work and the problem scale is interesting. Would definitely explore full time opportunities here.	Very few cons but WFH makes it hard to make friends at work!
42	Fantastic company to work for, one of the best in my career	 Post Lead SEA, ALOM	12 Sep 2022	5.0	"- a strong, supportive culture that values the employee's well being
- many opportunities for career growth
- engaging projects
- diverse team"	- there is a lot of information to learn at first, but it is better than having none!
43	Grateful to join a great team	 Technical Program Manager II	5 Sep 2022	5.0	My manager values WLB a lot. Although I am working with my team members remotely all the time, it doesnt block my motivation to work hard and discuss / chat with my teammates because they are all very nice and friendly. I look forward to my future growth together with the team!	I do not have teammates located same as me so I work from home everyday. Not necessarily to go to office but still feel a little bit of physically disconnected.
44	Least attractive among Big Tech Companies	 Senior Financial Analyst	3 Sep 2022	3.0	Pay is decent, but no variable bonus	work life balance is the worst among FAANG, Highly recommend to join other companies in FAANG.
45	Complicated system	 Account Executive	2 Sep 2022	1.0	Sign on bonus and stocks	Complicated interface. Too many escalation path
46	Everyday is always Day 1	 Anonymous Employee	2 Sep 2022	5.0	"- Surround by smart team mates and they always very helpful. No unanswered question left
- Everyday is really Day 1, you will absorb every info there is in your first 3-6 months"	WFH is kinda default mode, for new joiner is a bit shocker when you came to office in your day 1 but nobody greet you or welcome you. You will need to do everything by yourself eg: setting up email, etc.
47	Excellent Job for graduates	 Account Health Specialist	2 Sep 2022	4.0	Always Day 1 in Amazon. Good for people who prefer fast pace setting and learning new stuff all the time	Managers do not know the day to day job of the specialist and do not handle the customers themselves, yet still trying to tell us to observe our metrics on how to handle customers
48	Fast-paced and Fulfilling Job. Awesome Place to work for.	 Program Manager	2 Sep 2022	5.0	"- Awesome environment to work in with everyone being very helpful
- Amazon hires the best - everyone is really smart
- Flexible work arrangement. Still mainly WFH.
- Good work culture"	"- Tough interviews (to hire the best)
- No other cons"
49	good for CV but overhyped company	 Marketing Manager	1 Sep 2022	2.0	"- smart and hardworking colleagues
- competitive salary"	"- repetitive tasks
- long hours
- legacy systems which are really outdated and poorly integrated, quite unexpected for a tech company
- steep learning curve
- strong competition within same team"
50	Fast Paced Environment, Great for Growth	 AWS Cloud Architect	29 Aug 2022	5.0	The environment is very fast paced, with fantastic learning opportunities since Day 1. Salary and compensation is good (RSUs etc), not to mention the strong brand name/prestige that comes from working at FAANG. You also get to work with highly intelligent people.	Work life balance leaves more to be desired, but that's due to being shorthanded in a high growth sector.
51	Good for cv	 Marketing Manager	24 Aug 2022	2.0	"great for cv
Really smart colleagues"	"Sharks... everywhere. They can definitely know when you're bleeding. 

Spend too much time on docs and reworking them. The amount that people bs on docs is too much."
52	Job experience	 Risk Manager	28 Jul 2022	4.0	"Respect environment. Everyone is nice and helpful
Nice working environment in office and hybrid"	"Strong competition 
Everyone is very hardworking so not so much work life balance if you value personal time after work"
53	Fast paced and self learning	 New Account Specialist	25 Jul 2022	4.0	Learning new stuff and working with committed colleague	Some of your personal time will be taken up as a result
54	Fast turnaround, professionally managed	 Sales Operations Manager	14 Jul 2022	5.0	"Very clear guidance delivered professionally
Quick turnaround from first contact to offer
Clear communications and expectations
Solid feedback post interviews"	Significant prep work is required for interviews
55	AWSome Onboarding Journey	 Training Specialist	13 Jul 2022	5.0	"Supportive Team Members
Positive team vibes
Tools everywhere to help one to succeed in the role
Its ok to make mistakes, learn and grow
Wikis for new hires/existing staff for learning"	Have to raise Trouble Tickets for access to most platforms although approval is granted within reasonable time-frame.
56	Motivated environment	 Associate Technical Account Manager	12 Jul 2022	4.0	A place that greatly values learning and working together. You will be highly motivated to work and scale new heights	Employee benefits are not as robust as your counterparts in USA
57	this is an anonymous post	 Senior Cloud Architect	7 Jul 2022	5.0	this is an anonymous post for salary	there are no downs in working for amazon
58	A competitive and demanding job	 	2 Jul 2022	4.0	"- Good salary, great exposure and progression
- No degree necessary
- Work resources available almost all the time
- Team is there for you when help is asked"	"- Overwhelmed by things to learn at the start
- No additional wage supplement until at a higher Level
- Tough interview
- Expected to be proactively learning, and produce output constantly"
59	Amazing work culture	 Assistant Vendor Manager	30 Jun 2022	4.0	Flat hierarchy, colleagues are all very helpful, the work-life balance is amazing and the pantry is amazing	lack of autonomy within teams that are smaller
60	Cool Place to work for	 Alliances Manager	29 Jun 2022	4.0	Innovative Company focused in growing the customers and understanding them. Fun place to work for.	Must write a promotion narrative with data points to support promotion and get various sponsors.
61	Employer review	 Principal CSM	24 Jun 2022	5.0	"Learn customer obsessed culture
Great people working with you
Highly employee friendly environment
Great learning"	Dont have any Cons so far
62	Good job - its a place for builders	 Senior Technical Account Manager	20 Jun 2022	5.0	"Nice Salary, 
Good Employee Benefits - Insurance Cover 
6 weeks of parental Leave, 
Mobile bill Reimbursement
Various Offsite to keep employee spirits high
Stock option
20 Annual Leaves
Hybrid Workplace - No mandate to come to office everyday.
Clear responsibilities defined for your role
3 months of training , something not a lot of other organisation have.
Onboarding buddy provided for your initial days at Amazon
Offices are filled with cookies , cola drinks , breads and ice creams.
Reimbursement for work from home equipment Like chairs, table, monitor etc"	"No Annual bonus
There is a decent chance that annual hike might not happen
Place for builders , so work can become exhaustive.
Work life balance
Amazon will tell you what to do , but how to do , is something everyone has to figure out on their own"
63	Awesome	 Enterprise Service Manager	16 Jun 2022	5.0	"- Always learning
- escalations are encouraged
- Inclusive, Diversity and Equality is the norm"	"- need to be able to prioritize on the urgent and important tasks
- Day 1 means always building building, processes are guidance and may not be prescriptive"
64	Stressful environment	 Account Health Support Specialist	15 Jun 2022	3.0	The pay and benefits are good. Can learn different cultures in US company and work with foreign colleagues.	"Call Center job. 
No time for toilet. Even there’s two 15 mins breaks but it was according to the system so you only can go at the certain time. If you can’t finished your call before the break time then you might not able to go for your break.

Toxic environment. Gossip alot. Very hard to have progression because managers are bias."
65	Its Always Day 1	 ESM	10 Jun 2022	5.0	Excellent working environment, good colleagues and great synergies between teams	No cons so far noticed
66	Working Environment	 Associate	8 Jun 2022	3.0	Even though it is a huge warehouse, the management tries their best to keep the working environment safe. The employees are also very friendly to everyone, especially to the newly hired associates.	Limited shift and the pay are not attractive enough.
67	I worked as TPM for 18 months	 Technical Program Manager	7 Jun 2022	4.0	"Excellent benefits.
Work life balance, but do expect some meetings to be held at wee hour."	"Promotion may be super difficult depending on the team and the colleagues you work with. 
Base pay is below market.
Ridiculously low annual salary review (regardless performance), probably the lowest increment I ever had in my entire career life (16 yrs).
Stock option no longer attractive."
68	Good	 Team Lead	6 Jun 2022	1.0	Good learning curve, lots of opportunities for lateral move.	No WLB, can have better time-off,
69	Technical Program Manager	 Technical Program Manager	31 May 2022	4.0	Manage your own scope and time	On-board virtually and have team resides globally is a challenge in ramping and team building
70	Be ready and embrace change	 Partner Development Manager	30 May 2022	4.0	"- Great environment with lots of smart people.
- Company culture values loyalty and respect tenure
- Data driven and rational decision making processes"	"- As with all large organisations, there are parasites around trying to gain credits for work
- Change is so common that it disrupt proper work
- Expected to contribute above and beyond which means high pressure and stress (albeit still manageable IMO)"
71	Depends on what you really want	 Operations Associate	24 May 2022	2.0	Get to know more people	Endless work and repetitive jobs
72	huge opportunity	 Anonymous Employee	20 May 2022	4.0	"market leader and wide reach
flexible hours
hybrid setup"	"process duplications
weak internal tech tools for a tech company"
73	Working as AHS	 Account Health Support Specialist	17 May 2022	4.0	Good benefits, medical coverage and leave entitlement	Need to be Good at multi tasking and handling frustration.
74	Good learning environment	 Account Manager	14 May 2022	4.0	"High standards 
Smart and hardworking co-worker"	"Long working hours
Overwork
Change of priority frequently"
75	Customer-centric and goal-driven organization	 Anonymous	5 May 2022	5.0	"- Nice office locations in the center of CBD
- Better work-life balance than a lot of my previous organizations (I worked for banks).
- Very customer-centric, everything we do we do it for our customers 
- Very helpful colleagues who will always try to make you feel welcome
- Embraces working from home"	- A bit disorganized since it is still considered a startup, will take some time to really understand your own roles and everbody's else roles.
76	Good benefit	 Solutions Architect	30 Apr 2022	5.0	Great culture, great colleagues, decent office.	Sometimes really challenging customers to handle
77	MNC culture	 Anonymous Contractor	19 Apr 2022	4.0	"good office facilities & views
very flexible working style and hours"	"big dreams and capabilities but most employees are not passionate. 
a lot of deep diving in metrics, reporting on wins & misses but never put learnings into good use, which makes it redundant."
78	Fast-paced,  awesome team	 Operation Lead	19 Apr 2022	4.0	"Good team support
Existing work growth opportunities
Frequent job training"	"Fast-paced working environment
Turnover pretty high"
79	Onboarding at Amazon	 BD GTM Specialist Leader APJ	13 Apr 2022	4.0	Great self paced process, training content sequencing, and focus on enabling employees around the leadership principles and culture at Amazon!	Initial days at overwhelming with the content!
80	Great place	 Category Specialist	7 Apr 2022	3.0	Always learning something, it’s okay to ask questions	No proper training before on boarding to the role
81	Many pluses and some minuses	 Finance	4 Apr 2022	5.0	"-Team is friendly and helpful.
-Supporting Asia, good work life balance.
-Nice office at Asia Square (there are multiple work locations, depending on the team you are with)
-Reasonably good supplies of free drinks, snacks, fruits, etc at the pantry and there are many pantries!
-Good pay"	-Frugal (i.e. stingy) in terms of notebook (small screen, no touch screen) and travel policy (no business class even if flight time is beyond 8 hrs).
82	Consulting	 Software Engineer	31 Mar 2022	3.0	Flat Management structure and family type.	You are a full-stack software developer.
83	Interview takes a long time with more than 3 rounds.	 Partner Client Architect	31 Mar 2022	1.0	Much new things to learn.	Lots of work and much OT.
84	good exposure	 Account Health Support Specialist	27 Mar 2022	3.0	learn projects management through stretch opportunity and side projects.	too structured culture and old school thoughts, no presentation skill needed, just writing, which is so boring, and job satisfaction is low because there are so many Leadership principle to frame you up.
85	Overworked, and additional ad-hoc projects	 Data Center Technician	25 Mar 2022	2.0	The prestige of working in the world's biggest company	Very competitive company everyone is up stepping everyone to get recognized.
86	AWS Great Place Learning	 DCEO ( EOT)	24 Mar 2022	3.0	AWS is a great place to learn. There’s a lot of brand new stuff and learning program offered to employees to continue diving deep into their own career development in view of future perspective	There is no work life balance. AWS promotion is very slow and the workload here is damn overwhelmingly big. Have to quickly adapt in this fast pace and stressful environment.
87	New Joiner Review	 Senior Cloud Architect	22 Mar 2022	5.0	The company lives and breathes by the Leadership Principles, they are not for show unlike other companies, and the culture is excellent. The focus on onboarding is the best I've seen in my 10+ years of working. Hierarchy is flat, the colleagues are excellent, there is a high level of psychological safety in terms of speaking up and making honest (non-deliberate) mistakes. All of their working principles are backed by scientific research you have probably read in articles (eg. Harvard Business Review, etc), but almost never followed in your current company ever - except Amazon. Technical wise, you working for the world's best Cloud Provider and have a ton of opportunities to learn.	"The culture is not for everyone. 

You have to be very disciplined, a self-starter, and manage your own time and career. In short, you must have a high degree of ownership. This is not a con if you have the right mindset and making very deliberate choices on what you want to focus on (job, experience, family, etc.)

Looking at what others have written negatively, especially about work-life balance, they are more of a bad fit rather than a con of working at Amazon. There are many avenues to seek help when you feel overwhelmed, but you have to own the decision."
