	Summary	Job Title	Date	Overall Rating	Pros	Cons
88	Potentially confusing environment, but great colleagues	 Program Manager	21 Mar 2022	4.0	I love my coworkers and seniors. They are all very smart and give great feedback.	Environment of builder-culture can lead to lots of confusion and double-work.
89	A-MAZE-ON!  - amazing and a maze to figure!	 Compensation Specialist	20 Mar 2022	5.0	plenty of opportunities, legitimately 100% peculiar, great vibe	overwhelming from time to time, given the scale of the company
90	The Leading Cloud Provider	 Senior Specialist Solutions Architect	18 Mar 2022	5.0	"Work with best minds in industry
Understand the culture of innovation
Best chance to learn about AWS Cloud"	Nothing I can think of
91	One of the best company I have worked with	 Field Mechanical Engineer	16 Mar 2022	5.0	Lots of learning and opportunity to innovate.	Lack of processes which makes it difficult for new hires.
92	Mba	 HRBP	15 Mar 2022	5.0	leadership principles and high standards	Huge company may hinder speed
93	Onboarding	 IT Support Engineer	14 Mar 2022	5.0	Great way to introduce new staffs of the company policies	No Cons to report so far
94	Amazing Experience	 Senior Program Manager	13 Mar 2022	3.0	Fast paced, a great place to learn and work with full freedom	Work life integration issues in the long run
95	Good	 Senior Program Manager	9 Mar 2022	5.0	Excellent work culture, lots of opportunities	Performance driven culture, still good
96	too many repetetive processes	 DCO Technician	7 Mar 2022	3.0	good colleagues and helpful team mates	the processes keep on adding and there is no end to it.
97	Top executive are jokes!	 Sales Associate	1 Mar 2022	1.0	A few of the top executive in Amazon are rigid and does not have a clue on what they are doing.They run to companies after years and sit at the top with zero clue on the ground work.	Stay away the management sucks!
98	Dislike	 DCEO Facility Engineer	27 Feb 2022	2.0	Good colleague,.working together and friendly team	Bad man management and senior management. Only focused on getting things done. If you do good, its expected. But if you do bad, they will scrutinized you badly
99	New-joiner review	 Global Account Manager	27 Feb 2022	5.0	The focus at on-boarding is second to none - learn about us, DEI, culture, peculiar things and critically the Leadership Principals. Time is allocated officially through a structured Embark Plan agreed with your direct manager. You literally will not be touching your new job until you are on-boarded and accredited and that is excellent.	The volume of on-boarding collateral is huge, and some on-boarding programs are repeats of each other. You have to be your own time-manager to ensure you do the tasks and become an efficient Amazonian - it's down to you as it is very self-serve environment in Amazon even more so now with Covid-19. But this is also a Pro.
100	Data centre trainee	 Data Centre Operations	24 Feb 2022	4.0	"Good benefits
Good salary
12 hour shift work"	"Stringent security
Long Q during lunchtime"
101	Good Learning	 Intern	23 Feb 2022	5.0	Impactful and meaningful work with good learning opportunity, many smart minds around	Too many things to do and learn, lack of work life balance - long working hours including weekends to catch up
102	Amazing Upskilling Opportunity	 Associate Corporate Counsel	23 Feb 2022	4.0	"1. Great culture of helping each other
2. Tonnes of written resource for learning and development
3. Good culture of constant feedback loops and optimisation
4. Remuneration"	"1. Messy learning systems - too many platforms!
2. Unequal expectations of knowledge on different departments - some end up having to hand hold others through established processes
3. Steep learning curve"
103	stressful environment	 Senior Solution Architect	22 Feb 2022	3.0	"work from home flexibility
base salary"	politic , promotion process, work life balance
104	Not good	 Account Health Specialist	8 Feb 2022	1.0	Break time and personal time	Headless chicken , lousy system still in the. 90s
105	Salaries	 Warehouse Associate	8 Feb 2022	3.0	The pay is good as well as the welfare of associates. There are several incentives every month.	It may sometimes feel boring.
106	Experiencing everyday is a Day 1.	 Account Health Specialist	6 Feb 2022	5.0	"Amazon is a great company; trains employees into great leaders. 
Awesome management, warm and helpful colleagues and many growing opportunities.
Amazonrians encourage one and another. Amazon has very united leaders and team members relation."	Personally I do not see any cons in Amazon. With the positive and proactive mindset, seeing things in different perspective, with learn and be curious spirit, able to accept coaching for improvements. Myths cons will always turn into pros.
107	No bonus	 Specialist	5 Feb 2022	3.0	Work life balance, big company	"No bonus, 
Difficult for career promotion"
108	Stay away	 Anonymous Employee	5 Feb 2022	1.0	The smile in your face	Then stab you in the back
109	Na	 DCEO Facility Engineer	31 Jan 2022	4.0	Good place to learn new skills	Workload is high. Tons of admin work.
110	Positive on-boarding	 Enterprise Deal Lead	30 Jan 2022	5.0	Really impressive digital/virtual on-boarding experience despite almost all WFH. A tsunami of info but well presented and managed in my first couple of months. Strong program to shadow peers to get up to speed as quickly as possible.	Many tools and systems are available and trying to understand where to go to for info can take time and coaching/ learning much through experience.
111	Good working culture	 Specialist	26 Jan 2022	5.0	"- Helpful colleagues
- Good trainings to prepare for official works"	- shift works on weekends or PHs
112	good workplace of part time	 Associate	24 Jan 2022	4.0	fun activities during festive season, manager is good, free hot and cold beverage from vending machine.	work days and schedule might not be fixed
113	Very good	 Strategy Associate	23 Jan 2022	5.0	Very good employment benefits and team culture	No con that I can think of
114	Good place for career growth	 Engineer	19 Jan 2022	1.0	Good place for Career advancement	"Low pay for the hectic works . 
Poor management."
115	Great Onboarding experience	 Solutions Architect	18 Jan 2022	4.0	"I've only been here for less than 6 months, so main comments are regarding onboarding experience
- Very helpful manager/mentor and team. Can't comment on other teams though.
- Guided onboarding with clear tasks and activities to perform
- Choice of laptops
- WFH equipment compensation
- Mobile/bill compensation
-AWS exams compensation
- Flexible working hours"	"- Be prepared for information overload during onboarding period
- Even though it is encouraged to have a good WLB, it is difficult to keep up with the amount of things to do"
116	Technician	 Technician	17 Jan 2022	3.0	"Good Amazon feedback
Bonus was nice
Social place"	There is a 5 word minimum
117	Great place to work in	 Principal Product Manager	16 Jan 2022	5.0	Even though Amazon has got some negative press, its actually a great place to work in. The work you do is meaningful and has immediate impact to large communities. It's usually bar raising work and can be meaningful to your career especially in cloud and tech.	It can be quite taxing. The pace of growth is very fast, so everyone needs to learn to sometimes take a break.
118	Everything is Good	 Account Specialist	14 Jan 2022	5.0	Everything is Good : )	so far so good : )
119	Good company	 Associate	11 Jan 2022	3.0	Best resource.people are nice,after gaining experience can become a team leader.	Too many hours have to Walk
120	AWS Singapore	 Solutions Architect	7 Jan 2022	5.0	Great place to work, a lot of learning opportunities been provided to grow and continuously development. People are willing to share and help each other all the time.	There are so many things to learn, but this is also an advantage if you enjoy the continuous self-improvement
121	This particular role is not for the Faint Hearted	 Account Specialist	31 Dec 2021	3.0	"-Health Benefits are above average
-High pay for the role above market rate
-Proper training is in place with a lot of meterial to learn from and seniors to learn from, training is 4 weeks theory and 2 weeks hands on and relatively a steep curve.
- A bit about the role, timing is 830 - 530, officially need to be operational 900 to 500 on a 5day rotational schedule. If your schedule falls on weekends or PH you still need to work, as per norm, you will be credited 1 day extra leave for PH
-for Chinese Specialist, make sure your Chinese language speaking, reading and writing really is proficient or it will be challenging on top of the steep learning curve.
- Amazon's culture is Everyday Is Day 1 and this is very true as there are every changing sops and procedures.
- Be prepared for a rollercoaster ride
- If you want a relax job or you are the type that needs time to think properly or is slower at doing work and CANNOT MULTITASK, this role is definately not for you!!!
- it is not a normal call center role where you just need to reply to customer enquiries, part of the role is to investigate cases as well. You do learn alot but at the same time depending on an individual's mindset it is not for the weak hearted as it is quite overwhelming once you are on the 'operating floor'"	"-This particular role is extremely intense due to the call centre nature. 
-The timing is stringent and no leeway to relax at all except during the 2x15min break window and lunch time
-You have to log in and out and be accountable for every minute that you are 'working' 
- be prepared to sit your butt down without moving unless you are on break or lunch."
122	Great environment to kickstart your career	 Team Leader	27 Dec 2021	5.0	"Lots of room for internal growth and development
Probably one of the highest welfare - medical package in Singapore"	Multiple projects to handle as It’s always Day One
123	Comprehensive training and support from team	 Risk Specialist	22 Dec 2021	5.0	United team at time feels very close like family	Promotion rate is slow, dormancy in your role seems like a common thing in Amazon.
124	Not too bad	 Program Manager	22 Dec 2021	4.0	- Tons of exposure to different domain/subjects	"- Competitive environment
- Social Hierachy"
125	You cannot go wrong being obsessed over the customer	 Solutions Architect	22 Dec 2021	4.0	The company puts customer first in everything. Giving the customer the greatest value is the obsession of its leaders. Always do what's best for the customer, preferring long term wins over short term gains. Invent and simplify for the customer's sake.	Too many independent teams making independent decisions can sometimes result in inconsistency. Being over focussed on the leader principles can become too inward looking.
126	Great so far	 Anonymous Employee	21 Dec 2021	4.0	"- The Onboarding plan is structured and trains each new hire in the Amazonian ways. 
- Successful company that is always looking to innovate. It’s still Day 1. 
- Great leadership principles I can identify with."	There is room to be more agile. Working hours can be improved too but might be challenging due to working with global teams.
127	Great place	 Head of BD	18 Dec 2021	5.0	Dynamic, ambiguous, missionary, smart team,	Relentless, can consume you if not careful
128	Glorified Call Centre Agent	 Account Health Specialist	17 Dec 2021	1.0	Healthcare and dental benefits is solid	"absurd way of measuring KPI.
meaningless jobscope
no alignment between department
guess what? Even customer service department in amazon does not handle inbound abusive call like this position"
129	AWS Review	 Solutions Architect	16 Dec 2021	5.0	Work with smart people, plenty of opportunities to learn new technologies, skills and make an impact.	None experienced so far in my career.
130	Lower than expected salary, slow progression	 AWS Professional Services Consultant	13 Dec 2021	3.0	"Nice people to work with
Good welfare"	Might be easy to get promoted but salary difference is not much
131	Good place to learn and strong organisational culture	 Business Operations Specialist	10 Dec 2021	5.0	"- Good place to start your career
- Exposed to robust frameworks (or tenets/LPs as we call it)
- One of the highest salary in industry
- Lots of learning resources, mentorship and skills upgrading opportunities"	"- Might not be a good fit for those that appreciates high flexibility working style due to strong culture and mechanisms in place
- Approvals can be slow since it is a huge organisation"
132	Complete opposite of reviews here	 Recruiter	7 Dec 2021	5.0	Right from the first touch point of applying for the role and going through the interview process, it has been nothing but amazing. Contrary to the negative and bad reviews from others, it is totally not what I’ve experienced. Amazon is huge with lots of different entities and businesses, it’s not fair to generalise bad experiences across different teams and businesses.	No swag on day 1, lots of training videos and materials, many different platforms to navigate. Benefits not as competitive compared to the other tech giants.
133	Strong and clear culture	 Intern	2 Dec 2021	5.0	Big fan of the leadership principles - they do what they preach. A high-performing team that is nurturing and will actively seek opportunities to give me learning and visibility. Certifications are claimable and that's great for skills advancement. Very clear career progressions too.	Work-life balance is something that they are working on - but someone with ownership is unlikely to switch off and truly embrace work-life balance. Not an environment for everyone - suits ambitious people more
134	Startup vibe and thinking long-term	 Specialist	1 Dec 2021	5.0	Flexible and Innovative, rooms for discussion and experiment. This is much needed when dealing with new tech.	Dynamic and productivity systems are not integrated
135	It's all real	 Senior Operations Executive	29 Nov 2021	3.0	Not much to say here, everyone is a number	Again, everyone is a statistic
136	Great company	 Customer Service	28 Nov 2021	5.0	Great employees benefits & medical benefits. High annual leave balance	No cons pretty good company
137	It's a so so position	 Account Health Specialist	18 Nov 2021	2.0	I cant think of any	There's almost nothing good about this position, only here coz the Company benefit was okay
138	Great company and lots of learning opportunities	 Business Development Manager	16 Nov 2021	5.0	"- Collaborative environment
- No two days are alike; its very challenging, but I enjoy it
- Flexibility and autonomy 
- Lots of learning and upskilling opportunities"	- The organisation is very large; will take time to navigate and get to know everyone (especially under the current circumstances)
139	Good	 Account Health Specialist	15 Nov 2021	5.0	"-Friendly and Helpful Team 
Lots of Learning Opportunities and Resources provided"	Competitive and can be stressful
140	Fast pace and challenging	 Technical Program Manager	13 Nov 2021	4.0	Fast paced and hardworking co-workers. Defects get fixed quickly and new process which are more efficient are implemented on the fly.	Dealing with ambiguity 24/7 and immense work load.
141	great flexibility and autonomy	 Human Resources	10 Nov 2021	5.0	people respect each other, provide everyone with autonomy at work, great values and en environment which promotes learning culture	certain processes are lacking / can be improved.
142	Can be busy, but work is very focused	 Solution Architect	8 Nov 2021	5.0	Plenty of learning and upskilling opportunities. Get all the AWS certifications if you like. Colleagues are generally helpful and friendly and you can get mentorships. Internal transfers can be requested for. Fully work from home during COVID.	Work can be rather busy at times, especially during the first 3 months of onboarding. Knowing how to prioritize and guard your time is important.
143	Great	 Principal Product Manager	1 Nov 2021	5.0	Good ownership. Strong product development process. Lots of opportunities for growth.	Company culture is diluting with scale. Many leaders now clearly no longer customer obsessed or passionate about building. More focused on building career milestones and associated politics.
144	Web Operations	 Anonymous Employee	28 Oct 2021	1.0	"Good Salary Offer
Good staff benefits"	"The staff there refuse to provide proper training to new hires. Some existing staff are from overseas and some are previously from military.
Some new hire staff have to leave job due to poor support from existing staff."
145	Intern	 Undergraduate Student	28 Oct 2021	4.0	Fun and fast environment, engaging and dynamic	Not suitable for those who wants a 9-5
146	Lots of flexibility and autonomy	 Business Program Manager	19 Oct 2021	4.0	great culture, good pay, awesome colleagues, lots of ownership given	some early and late nights required due to regional nature of job
147	Good place to work	 Program Manager	18 Oct 2021	5.0	"Supportive superiors.
Diverse staff.
Empowered to make decisions."	"Fast-paced environment.
Some processes not established."
148	Account specialist	 Specialist	15 Oct 2021	3.0	Pay is above average. A lot of opportunities here.	Intensive workload. Fast changing business direction lead to big confusion between team communications.
149	Love it or hate it	 Senior Partner Development Manager	13 Oct 2021	3.0	Amazon LPs and mechanisms, good brand	High churn, hard to get promoted at the mid-level
150	decent so far	 Sourcing Recruiter	11 Oct 2021	4.0	Good compensation, very friendly and smart co-workers	very big company and you might find it hard to envision your impact.
151	Job scope	 Anonymous Employee	10 Oct 2021	3.0	Same tasks daily doing same thing	Must follow their break time
152	Great company with benefits	 Packer	9 Oct 2021	5.0	lots of benefits from the company	lack of rest time to relieve back
153	great company	 Sales Manager	8 Oct 2021	4.0	freedom exciting delivery-focused fun results driven	long hours tough hard work
154	Great company to work	 Head of Program Management	5 Oct 2021	3.0	"Smart and talented colleagues
Challenging objectives
Agile planning"	"too bureaucratic
highly stressful 
lot of manual work"
155	Great for growth but bad for parents with kids	 Program Manager	30 Sep 2021	5.0	You get to learn a lot, it’s always day one. Work with smart people	Overworked due to insane workload. Benefits isn’t as good as the rest of FAANG
156	Day 1 everyday	 Network Engineer	29 Sep 2021	3.0	Good place to learn and grow.	Don't expect much work life balance.
157	Amazon review	 Assistant Vendor Manager	22 Sep 2021	3.0	Steep learning curve. Can learn so many things	Amazon is so messy. Has many tedious work
158	Good place to work	 Marketing Ops	17 Sep 2021	4.0	Great people with good talent	Long hours of working at times
159	Expect the Unexpected	 Vendor Management	16 Sep 2021	2.0	Great remuneration and medical. Autonomy to drive initiatives and ownership of projects that are aligned with broader organisation goals	"Inefficient SOPs and too many ""self-service"" tools that ironically creates more problems. Blame culture within some teams that deters team cohension. Burn out prevalent in the organisation culture"
160	Learning ground	 Principal	13 Sep 2021	4.0	Lot of technology , huge learning space	Lack of collaboration, very individual-centric
161	Warehouse Associate	 Warehouse Associate	11 Sep 2021	4.0	"Friendly colleagues and staff
Aircon environment"	"Physically tiring
No food options
Repeated work"
162	PM @ AWS	 Program Manager	8 Sep 2021	4.0	Autonomy on projects. Flexible working hours and location.	Can be overwhelming and very fast paced.
163	Fast paced, innovative and solid experience	 Sales Intern	8 Sep 2021	5.0	Incredible work culture, you will not feel bored a single day on the job	Struggle to keep up with pace with things changing so quickly, roles can be granular at times
164	-	 Account Specialist	6 Sep 2021	2.0	Good Medical benefit/ Annual Leave	Systems are not so user friendly
165	Average experience	 Associate	5 Sep 2021	3.0	"Fun working environment
Good to work with friends"	"Toxic people
Always supervised
Have to prepare own meals"
166	Amazing culture	 Biz Development	1 Sep 2021	5.0	Great company to work for	None that I can think off
167	internship program	 Business Development Analyst	30 Aug 2021	4.0	"- strong company culture
- many experienced people"	- very processed driven so not suitable for everyone
168	Tech leadership  and cutting edge working	 Head of Strategy and Business Development	23 Aug 2021	4.0	- Discovery, startup mindset, speed and execution, freedom to experiment	fast growing, speed of scale
169	Great company	 Intern	23 Aug 2021	5.0	many opportunities to work around love the culture	conversion is rare for interns
170	Meh	 Warehouse Associate	5 Aug 2021	2.0	"flexible to shift timings 
paid training
warehouse supervisors are occasionally nice
not really alot, i feel that occasionally they track you down in the warehouse to tell you if youre not meeting a KPI or if you messed up - they dont really have a nice tone"	rude people working with you, esp during peak hour, they will push you out of the way so they can meet their kpi. esp at chill and freezer section
171	Place for Burnouts	 Supply Chain Manager	4 Aug 2021	2.0	Good remuneration package and insurance coverage for family	Heavy workload and lack of work-life balance. Poor career progression and managers are focused on using your existing skill set to resolve problem while neglecting to grow the individual
172	Great company to work for	 Recruitment Consultant	31 Jul 2021	4.0	Great leadership, very open and transparent. My team is very hands on with a there's no I in team attitude	Sometimes need to work longer hours and workload increases. Team sometimes run understaffed. Otherwise ok, i enjoy and love working here
173	Flexibility and trust	 Project Manager	30 Jul 2021	4.0	Fortunate to be in an org filled with supportive teams, managers and colleagues.	A few incompetent apples who leaves the cleaning up to the competent peers, but I suppose it’s the same anywhere.
174	Great colleagues and team to support you, not a flexible working hours, tedious	 Customer Support Specialist	24 Jul 2021	3.0	Great team, people are very supportive	Too tedious multi-tasking, not a flexible working hours
175	Senior PM	 Senior Product Manager	22 Jul 2021	5.0	Autonomy to be creative and drive ones own roadmap	Constant pivots in business direction leading to churn
176	Great exposure	 Intern	22 Jul 2021	4.0	good experience in the cloud industry	have not worked long enough to conclude
177	amazon	 Administrative	22 Jul 2021	4.0	"comfortable for work place
great benefit employee"	"work overload
cannot use phone when working"
178	NA	 Mkt Manager	21 Jul 2021	5.0	good fast paced culture. nothing to complain	no free lunch, many stakeholders
179	highly not recommended as per all other reviews	 Account Health Support Specialist	17 Jul 2021	1.0	not much OT, other than that nothing else	treats you like a prisoner. micro-managing to it best.
180	Great Company	 Program Manager	15 Jul 2021	4.0	Great Comp for every employee	Work life balance and quality of work
181	Pay	 DCEO Trainee	13 Jul 2021	1.0	Can learn a lot of things	Regional management cut a lot of costs. Promotion need to wait so long. Most of the benefits are started from L4 and above.
182	Good company	 Programmer Analyst	10 Jul 2021	4.0	Good environment. Good pay and good people	No apoarnet. Energy is a must
183	AWSome company	 ISR- Inside Sales Representative	4 Jul 2021	5.0	always Day 1, tons of stuffs for you to explore everyday	nothing seems to be cons
184	Good Progression	 Program Manager	1 Jul 2021	4.0	Progression is structured to be customisable	Job satisfaction epends on the type of manager you have
185	Amazing workplace	 Business Manager	30 Jun 2021	4.0	Great culture, leadership principles are awesome, smart people	Highly Performance based, ambiguous environment
186	Join to experience	 Marketing Manager	24 Jun 2021	2.0	"Good pay
Smart colleagues
Good work gear"	"Frugal
Biased to sweet talkers
Too many meetings 
Paggro remarks in every meeting"
187	Good Company	 Account Specialist	23 Jun 2021	5.0	"-Work-life balance
-Good management
-Listen to feedback"	"-Rotational shift 
-Requires to work on weekends"
188	Best place for an agile person	 Senior Marketing Manager	20 Jun 2021	4.0	A lot to learn..Everyday is Day1	Too many things to do, no work-life balance.
189	Would recommend	 Intern	17 Jun 2021	4.0	"relatively flat team structure
independent way of working
respectful teammates
good leadership and mentor
lots of learning opportunities"	better work from home arrangement
190	Great place to work	 Senior Manager	13 Jun 2021	5.0	Smart people, great learnings , competitive package and good stepping board for future roles	The work can be really taxing. At times political
191	Quite ok	 Senior Procurement Manager	11 Jun 2021	4.0	"Flexible and dynamic 
Opportunities for growth 
Open culture"	"No work life balance
Fast pace"
192	Not Perfect but has it perks	 Sales	4 Jun 2021	3.0	Pay is good. People are inspiring to work with. There's career progression	Workload will suck the life out of you, Culture is not for everyone.
193	Great Company	 Research Scientist	1 Jun 2021	5.0	Friendly team. Capable Team Leader. Learning Opportunity.	Some of the internal processes slightly messy.
