	Summary	Job Title	Date	Overall Rating	Pros	Cons
95	Good benefits, old teams	 Implementation Analyst	29 Jun 2021	4.0	Good work life balance. Great benefits like health insurance.	"Company is mostly people who have been with the company for many years (10+), so things are less flexible and slow (not up to date with current trend). 
Average turnaround rate seems to be higher for younger new joiners, while the oldies continue to stay. 
Not enough flexibility to try new things or change teams."
96	Great Culture	 Vice President	28 Jun 2021	5.0	Great people. Good work life balance. Global opportunities	Can be bureaucratic. Slow to make decisions.
97	Work Environment	 Credit Analyst	25 Jun 2021	3.0	Good communication lines between management, stakeholders and staff	Distribution of work load was not done evenly on occasions.
98	Great place to work	 Anonymous Employee	17 Jun 2021	5.0	Smart teammates, interesting projects and good work life balance	I can't think of any to add, I enjoy working here
99	High in tech and budget	 Director	16 Jun 2021	5.0	"Cutting edge technology 
Budget is not usually an issue
Security is the #1 priority"	"Process can be heavy
Security is the #1 priority"
100	Good team and work culture	 Associate Cybersecurity Analyst	5 Jun 2021	5.0	Good work culture and team	Nothing much of a concern
101	Good to work	 Senior Java Developer	2 Jun 2021	4.0	Good work life balance, Compensation	switching between the project is hard
102	Great workplace	 Senior Staff Engineer	29 May 2021	4.0	"1. Latest tech stack
2. Awesome LT
3. Good salary"	"1. Too much work pressure
2. Very difficult to get promotions"
103	Uncertain Plans	 Project Analyst Intern	23 May 2021	4.0	tried their best to make the coronavirus situation work	Lack of work for interns
104	Work in Visa	 Anonymous Employee	17 May 2021	5.0	Good work life balance , very good boss and culture	Very hard to promote for working level . Need average 5 years
105	Good work place	 Senior Systems Engineer	16 May 2021	5.0	"One of the best org where someone can manage work life balance very nicely

High techie org"	Hard to think of any
106	Company has a great culture with focus on employee well-being but some of the employees are ignored	 Director	13 May 2021	3.0	"Overall good working environment and senior leadership team do care about the employees and their well-being
Company strategy is also in-line with what is required in the market to grow"	"Unfortunately people like us who are working in the company for a long time do not get attention. Salary is competitive for persons recruited from outside yet strangely enough we (the long-timers in the company)do not get at par with the standard. I have been promoted to the role of Director long time back yet no adjustment has been made to the salary that should be the standard norm for a promotion. It is quite long that I am underpaid and only few minor adjustments have been done and that is way below the current standard of salary. Being a single earner in the family it really hurts. Moreover, in recent years the annual stock option has also been limited to few and as a result some of us getting ignored without any explanation.
There are also very limited opportunities for career growth path for people like us working in Technology division who are located outside of US. Nobody even bothers about it.
I really feel sad for my team for whom nothing much can be done working in a offsite location. Sometimes all I hear from the other side is what my team has done wrong and what they are lacking even though there are enough evidences of them going above and beyond regularly, working late in the night to deliver projects taking great amount of responsibilities"
107	Great Company, Weakened by Inefficient Highly Political Middle Management	 Engineering	7 May 2021	3.0	"Good CEO - Charismatic, Caring, Delivering in business
Great management of COVID situation, right messaging from CEO to support the employees (although issues in SG in helping employees)
Invest in Learning resources, a good place to do many courses free :)
Good facilities, games, rest place, gym
Nice office, comfortable cozy
Reasonable salary
Growing business, stability, Rich money
Many good people to talk"	"Leadership - All praise to CEO for many good, but he is missing on improving leaders completely. Many old school middle managers, focused on saving their fort and power. Lack of growth mindset to produce great products, lacking leadership and people skills. This is resulting in mediocre and very very political culture. 

Technologies - Sucks at this. Many years behind tech companies. Result of previous point. Engineering practices are from old time. Not learning after a point.

Hr - Does it exist? Lacking skills of tech companies. No focus on culture development. 

Overall a high potential company, but like a old era white elephant with tired and very political system. Not a place to grow as developer. No focus on great product development. Many startups with 50 people building better products."
108	A global company with great culture	 Manager	3 May 2021	5.0	Internal mobility, high impact (if on appropriate teams), lots of growth	Expected corporate limitations, slower processes, some bad/lazy managers but those at everywhere
109	Relax work environment	 Staff Software Engineer	29 Apr 2021	4.0	Good work culture and no stress at all	Nothing new to learn but more of BAU work
110	Overall it is a great company to be in	 Senior Software Engineer	27 Apr 2021	4.0	Great environment and work life balance	I have had the opportunity to work in two different team and have a few changes in terms of management/leadership. You can tell if your managers are genuine or not. If you did not get a good manager, just bear with it or move to another team!
111	Good place to work, high pressure, low diversity	 Analyst	27 Apr 2021	4.0	Great place to work and learn	Low diversity, High pressure job, boss was not very open minded
112	Company that believes in wellness	 Event Planner	26 Apr 2021	4.0	Great perks and incentives. CEO has great vision and is a people manager	Too trusting and dependent on line managers.
113	Employee friendly and work life balance supporter	 Staff Software Engineer	23 Apr 2021	5.0	Employee friendly, supports work life balance, benefits are good,Stable company.	Base salary is less with respect total career experience
114	Excellent company of my career	 Senior Systems Administrator	17 Apr 2021	5.0	"- Non biased and employee friendly environment
- Lot to learn due to Visa's involvement in cutting edge technologies
- Very good in employee benefits and perks"	"- Nothing specific to mention, just lacks the fun activities in office :)
- Another down side is sometimes you have to compromise on your work life balance due to timezone differences when you have to attend meetings with US counterparts"
115	Great	 Senior Help Desk Specialist	16 Apr 2021	5.0	Work environment and people are great.	Unfortunately too much power is given to undeserving managers and salaries could be slightly higher.
116	Good place to work	 Director	15 Apr 2021	4.0	Friendly environment. Good place to work	Some functions have one single colour
117	Nice people, quite stressful	 Trainee	15 Apr 2021	5.0	Very nice people in general	Can be stressful at times
118	Good Pay	 Senior Director	9 Apr 2021	3.0	Great Salary and benefits for staff	Political and untrustworthy work environment
119	Needs empathy	 Staff Software Engineer	8 Apr 2021	1.0	"Excellent set of people.
The work is great."	"(Singapore)No empathy towards employees to help them during difficult times like COVID. Literally the condition in the company is either you choose work or family. There is no support to get the employees who are stuck outside. While other companies are doing their best in Singapore to help retain their employees and help them balance the personal and professional life in all ways, Visa seem to have turned their back on employee problems during this covid. 
They have basically left no choice to their foreign employees but to leave and permanently go back to the place where they come from.

The HR policies are too stubborn and they are just adding to the difficulties during such times because of their stubborness to change. The immigration partner firm is doung a miserable job here in Singapore to help the stranded employees get back and on top of that they are charging a hefty amount for service which is absolutely free. It has been 1 n half year into pandemic and it may be around for ling and if this is the support that the foreign employees get at this time, I think it is time to rethink about the relationship with Visa"
120	Good Company to work for	 Anonymous Employee	8 Apr 2021	4.0	Brand, Organize, Leadership, Learning, Benefit	Heavy work load, Pressure, Processes
121	Good Work Life Balance	 Staff Software Engineer	6 Apr 2021	4.0	Good work life balance and generous PTO	"Pay less compared to other tech company. 
Difficult career advancement if you're not from some certain country."
122	great place to learn	 Analyst	30 Mar 2021	4.0	Good team, inclusive, emphasis on development	large organisation, unclear about mobility
123	Good Company to work with.	 Senior Software Engineer	19 Mar 2021	5.0	"1. Learning is high.
2. Growth is good.
3. People oriented company
4. Best for women.
5. Have experienced both Bangalore and Singapore"	1. Work life balance but that's domain specific.
124	Great firm with lots of learning opportunities	 Financial Analyst	17 Mar 2021	5.0	"1. Hone business acumen in Payment Technology industry
2. New tools/platforms which are up-to-date. Every day is a new day!"	None as of now. Maybe more Visa card discounts.
125	Good Culture	 Business Associate	14 Mar 2021	5.0	People are nice, great culture, good work life balance	A lot of layers. Decision making is slow
126	Good work life balance	 Senior Software Engineer	13 Mar 2021	3.0	Good work life balance and stable	Career promotion circle is long.
127	Not a good place to start your career	 Senior Software Engineer	12 Mar 2021	3.0	Helpful staff and general atmosphere	A lot of politics and questionable promotion criteria
128	Good benefits	 Customer Service	5 Mar 2021	3.0	Good benefits in terms of salary and medical	Shift hours and without worklife balance
129	Work Life balance	 Associate Systems Administrator	4 Mar 2021	5.0	Work Life balance, good company culture	Not I can think of
130	Great company	 Senior Software Test Engineer	2 Mar 2021	5.0	They give High pay and bonuses	Politics within the company is rampant
131	Great company	 Software Engineer	1 Mar 2021	5.0	"Good work life balance
Nice work environment"	Salary is lower than other tech giants
132	Life as an intern	 Intern	1 Mar 2021	4.0	Work force is very international based. There are tons of westerners and people from other countries in a team.	Most people will not bother to interact much with the intern as we're only there temporarily.
133	Holistically a great company to work for	 Director	24 Feb 2021	5.0	"- Top Shelf Benefits
- Flexible working during Covid
- Managers are encouraged to look after staff
- Try to include staff in the community"	- For some roles it's hard to get promotions. So you need to move around.
134	Great Place to Work	 Data Scientist	18 Feb 2021	5.0	Good emphasis on benefits and work life balance	During projects, it can be a little stressful..
135	Payment technology	 Project Director	16 Feb 2021	5.0	Great people, very interesting work	Some processes do not match business needs
136	Payment	 Senior Director	14 Feb 2021	3.0	Very international working environment .	Development opportunities can be hard to come by,
137	Good Company but Not good managers	 Lead Software Engineer	9 Feb 2021	4.0	Good Company with nice culture, Good CEO, Very good employee benefits.	"Managers are not good to understand candidate potential, Hiring process is not well defined and not having good checks as some managers hire their known persons rather than talent. Lowe level managers are quite political.

Promotions are difficult."
138	Great company to work for	 Director	8 Feb 2021	5.0	Great culture and great leaders	It is very difficult to get promoted.
139	Not a bad company to work	 Staff Software Engineer	2 Feb 2021	4.0	So far everything was good	Nothing bad to shout about
140	Technology	 Staff Software Engineer	31 Jan 2021	4.0	An interesting domain area, the company encourages learning culture, provides a great learning platform. Opportunities are there to transfer based on your career growth	Please do select the correct manager who can understand your potential and develop accordingly. There are many great leaders who can mentor you.
141	Amazing Employer	 Staff Software Engineer	30 Jan 2021	5.0	Salary, Work-Life Balance, Job Security	Nothing major I can think of
142	Great place to grow your career	 Analyst	27 Jan 2021	5.0	great team, people are willing to guide and help you, good salary, lots of opportunities if you put your hand up.	None so far. I enjoy my work.
143	IT	 Senior Software Engineer	25 Jan 2021	3.0	Cool company, good management and stable job	No salary hike, allowing working from home in only working location.
144	Great place to work and learn	 Director	24 Jan 2021	4.0	Employee Friendly, Growth prospects, Great leadership	inefficient at times on the delivery of projects
145	Good Company to Start Career At	 Business Associate	24 Jan 2021	5.0	Flexibility, Lots of Opportunities, Good Mentorship, Truly Global	Sometimes still a bit rigid in terms of structure
146	Good	 Senior Systems Engineer	18 Jan 2021	4.0	"Flexible working hours, have work-life balance
management is good, care about wellbeing of individuals"	Can have slow processes and hard to get promotion.
147	Good Company	 Senior Software Test Engineer	17 Jan 2021	4.0	Flexible working hours and good work/life balance	Average employee age is high
148	Nice environment and company	 Software Engineer(Internship)	16 Jan 2021	5.0	We were given onboarding sessions as interns and it was made quite clear from the start that interns will have the opportunity to do real work here and are treated seriously as potential candidates to join the team. The conversion rate is high as far as I can remember and everyone I knew was working on something that was meant to put to use by the teams they were in. The environment as I knew it was positive.	Getting the necessary approvals to have access to software/code/environments took almost a month
149	Good place to retire	 Software Engineer	14 Jan 2021	4.0	"Good work life balance if not required to work with US teams
Good insurance
Tasks are simple"	"Hardly anyone gets promoted 
Work is driven by business not engineering teams
Salary can be much better for a company of this size and scale"
150	Great Company!	 Senior Software Engineer	8 Jan 2021	5.0	Great work culture where creativity is encouraged and appreciated!	Salary can be better especially for technology (to be on par with other leading tech giants)
151	Great culture and benefits	 Lead Engineer	4 Jan 2021	5.0	Exercises great culture and improving the benefits every year...	Slow in exploring / adopting new technologies
152	Nice place to work	 Senior Software Engineer	3 Jan 2021	4.0	Work life balance and good carrer growth	It took time to get promotions
153	Good company to learn business	 Senior Staff Software Engineer	24 Dec 2020	5.0	Good company to learn business	No dont see any Cons that really matters for me
154	Satisfied	 Anonymous Employee	6 Dec 2020	5.0	I'm happy to be part of visa team where I have got opportunity to showcase my talents and well rewarded in the first year itself. Visa is one place where your talent wont get unnoticed. Continue to do the good work.	No work life balance which is unfortunate not only due to covid and work from home, most of the work carried out from US time zone so ended up late night meetings and works.
155	OK so far	 Software Engineer	3 Dec 2020	5.0	Good environment for learning java	Ot can be very usually
156	The IBM of Payment Industry	 Senior Director	2 Dec 2020	3.0	"Financially strong.
People oriented.
Flexible work arrangement.
In a booming industry.
Strong brand.
Pays above average.
Al Kelly is pretty cool."	"It's a US company pretending to be an MNC, every decision is made in Foster City.
It's a financial company pretending to be tech company.
Company is very distracted by all the chaos at home (US), neglecting all other employees at hub sites who want to excel.
AP HR is utterly useless, just a glorified mouth piece for the so called 'Global' office.
Pay for performance is just a joke, low performing staff mysteriously gets RSU without a reason, while high performers were left in ditch. Direct manager has no say at all."
157	Very good perks	 Technical Support Analyst	29 Oct 2020	4.0	Snack and drinks are regularly restocked . Compensation and benefits are good.	ITIL practices are there but needs more polish.
158	BEST Company ever seen and worked.	 Senior Project Manager	28 Oct 2020	5.0	Open Culture. Fully Diverse & Inclusive. Great management. Excellent CEO.	supporting clients over multiple timezone, you may be working at odd times. But able to manage WLB due to flexibility.
159	Bad management	 Data Analyst	15 Oct 2020	3.0	Visa is a good company and probably has an excellent future, thanks to business model	Bad management especially at senior director and higher levels... Visa consulting and analytics is one of the worst managed teams..
160	Good team	 Recruiter	14 Oct 2020	4.0	Worked with one of the most demanding team in technology and learned a lot about working with stakeholders. Strong advocate of diversity and inclusion. They have have relatively good work life balance.	Limited opportunities in Singapore as majority of the initiatives are driven by the headquarter
161	good employer but limited advancement opportunities	 Senior Systems Analyst	29 Sep 2020	4.0	decent pay and good benefits	difficult to advance horizontally or vertically
162	A Company that advocates on diversity and inclusiveness	 Technical Account Manager	27 Sep 2020	4.0	Good welfare and thinks of both mental and health well-being for employees, especially during these times.	The renumeration can be better with the contributions made by performing individuals.
163	Lousy HR department	 Human Resources Professional	26 Sep 2020	1.0	Good corporate culture and ppl outside of HR are nice	"Lousy AP HR leaders
Toxic culture, bad work life balance"
164	Great company and great work culture!	 Software Engineer	23 Sep 2020	5.0	Great company and great work culture!	I did not have any complaints at Visa.
165	Nothing	 Project Manager	23 Sep 2020	5.0	Everthing all good All good	"All
Good no cons all good"
166	Great company	 Anonymous Employee	20 Sep 2020	3.0	Best talents in the region	Frequent restructuring, management and role changes
167	Good company	 Software Engineer(Internship)	19 Sep 2020	5.0	A vibrant and professional working environment	Because it is a big company so you don't get control of the big project
168	N/A	 Project Manager	17 Sep 2020	4.0	Great environment to work in	not many cons, da da
169	Global company	 Implementation Analyst	14 Sep 2020	5.0	Innovative, internal mobility, satisfying pay	No cons. Very satisfied with company
170	Not enough exposure	 Information Security Analyst	11 Sep 2020	3.0	Good corporate benefit and pay	Boss doesn't care your career interest
171	Good WLB	 Software Engineer Intern	7 Sep 2020	5.0	WLB, Learning opportunities, Good management style	None. Based on my experience so far
172	Pit of Vipers	 Senior Director	4 Sep 2020	2.0	"- High pay for middle management titles
- Able to coast by without doing any work if that floats your boat"	"- Political maneuvering to the EXTREME - in a company where 90% of people could go home and the company would still make money, people had no way to differentiate themselves except by politics
- The AP hub product team in Singapore went from a decent place to work to an absolute disaster in a couple of years
- Bad hires were never addressed - poor behavior and poor performance from managers was left unaddressed and the best people left
- Technology team is full of people who consider success to be having the most headcount, regardless of business outcome
- No documentation of processes or tools, company was in the process of locking down the one wiki we had so it wouldn't be possible to share information across areas
- Re-orgs happened regularly, every 6-12 months, creating constant fear and shuffling to try to get ahead of the next round of it"
173	Great experience	 Software Engineer Intern	1 Sep 2020	5.0	"Good team environment,
Helpful mentoring system"	COVID 19 internship becomes virtual
174	Java development backend	 Anonymous Employee	23 Aug 2020	4.0	Stable and nice working place. Sometimes the environment depends on the team you work. But overall it’s a nice place to work.	Sometimes it’s stressful. No time for error. Too much process driven.
175	Fantastic culture	 Vice President	23 Aug 2020	5.0	Bright people, great culture, working on cutting edge of digital,payments	Sometime bureaucratic slow to make decisions
176	Good environment for interns	 Software Engineer Intern	19 Aug 2020	4.0	Relax and mentor is concerned about your development	Technical work is not very exciting.
177	Great Interview Experience!	 Software Engineering Intern	17 Aug 2020	4.0	Great working culture and work life balance	So far I don't think there's any con
178	great place to learn and work	 Human Resources Analyst	17 Aug 2020	4.0	benefits are insanely good, diverse culture and sleek office	politics - but which company doesnt have?
179	Overall good experience	 Software Engineer(Internship)	4 Aug 2020	4.0	Good working hours and people	Intern management can be better
180	Good Learning opportunities	 Intern	24 Jul 2020	5.0	"- good timeline
- flexible working arrangements"	- work can be alot and challenging
181	Great place to work	 Manager	16 Jul 2020	5.0	Great executive leadership and culture	Processes can be difficult to navigate
182	Good company with great benefits	 Business Development Manager	13 Jul 2020	5.0	With the right leader, it's easy to see how your role is aligned with the goals of the company	Progression is challenging with the flat structure.
183	Innovative and great work culture	 Director	8 Jul 2020	5.0	Innovative , Great Work Culture, good employee benefits	Annual pay hike could be better
184	Good	 Senior Director	6 Jul 2020	4.0	Good place to work overall	Senior management has too much power without appropriate checks & balance
185	Treatment of Contractors	 Consultant	21 Jun 2020	4.0	welcoming, great culture, people are friendly	I didn't like the fact that certain internal websites/databases were only available to full time employees although in my role, I was expected to be performing at the level of a full time employee without access to a lot of information.
186	Good	 Human Resources	17 Jun 2020	4.0	Friendly and warm company that helps you achieve	Office politics and some favoritism
187	Open culture	 Analyst	29 May 2020	5.0	Great mentors, colleagues and interesting time to be in payments	Slow matrixed organization, requires a lot of approvals
188	Fantastic Internship experience!	 Intern	29 Apr 2020	5.0	Competitive pay in the industry.	No cons. Really good environment and opportunity :)
189	Great Working Experience	 Senior Systems Analyst	27 Apr 2020	4.0	"Work-life balance
Good compensation
takes care of permanent employees"	Due to covid19, they have started freeze hiring and layoffs
190	Collaboration first	 Senior Director	27 Apr 2020	3.0	Focus on work life balance	Need to make effort to collaborate
191	review	 Software Engineer	25 Apr 2020	3.0	I can learn a lot of stuff	The learning curve can be rather steep
192	Good company to expand your career	 Staff Engineer	19 Apr 2020	4.0	Good opportunities as the company as a whole is looking to keep getting better at technology.	It is so big the operations are so much spread out, it could be slow at times
193	Nice company to work with	 Staff Software Engineer	12 Apr 2020	5.0	"Good work environment
No work overload"	So far nothing I came across
194	Bad company for young people	 Software Engineer	26 Mar 2020	2.0	Great work life balance here	Politics, favoritism, mediocre management, no career growth
195	Good culture and work life balance	 Software Engineer	12 Mar 2020	4.0	It depends on the team that you join. Generally, the culture is flexible,  open communication, team members support one another, promote learning.	The career progression is slow. The advancing of a career can be fast or slow depending on the team itself. The task on hand might not be always interesting.
196	Pathetic Managers, Great WLB	 Senior Software Engineer	12 Mar 2020	2.0	Good work life balance, global brand, competitive salary	Terrible managers, too hierarchical, obsolete technologies, slow paced
197	Good work life balance	 Senior Project Manager	10 Mar 2020	3.0	Flexible working environment with good employee focused benefits.	Fast paced environment. More structure needed for their processes.
