	Summary	Job Title	Date	Overall Rating	Pros	Cons
0	Great place to intern	 Software Engineer Intern	13 Mar 2023	5.0	Learning culture is great with very knowledgeable and helpful managers	Development maybe abit slow compared to a startup
1	Great WLB	 Software Engineer	13 Mar 2023	5.0	- Amazing WLB - Great culture	- Things can be slow
2	Review for System Analyst Trainee	 System Analyst Trainee	12 Mar 2023	4.0	Good place to learn. People are willing to teach	Very low pay and low chances of conversion
3	Great team culture	 Senior Consultant Software Engineer	10 Mar 2023	5.0	Great team culture - teamwork and great collaboration. Women inclusion in the team. Promotes career progression	Race diversity can be improved
4	Compensation	 Software Engineer	26 Feb 2023	3.0	Good team and work life balance	Less competitive as compared to others
5	Best Culture	 Software Test Engineer	23 Feb 2023	4.0	Good reputation, best working culture, great colleagues, decent benefits, flexible and work/life balance.	"Depending on the team/department you are in, you might be micromanaged or given mundane tasks and it makes it boring. Sometimes feels like there are too many ""middle managers"" that don't do much except for attend meetings yet the juniors have the bear most of the work. Oh and they love contractors more than full time staff. Too many of them makes the team feel out of place as some are working remotely and there is no sense of belonging. Hot desk system not the best and hybrid model should stick to 2 not 3 days in the office."
6	Awesome culture	 Vice President	22 Feb 2023	5.0	People are truly valued, huge focus on collaborative approach to work, lots of opportunities to move internally	Lacks a performance based culture, can be slow moving
7	Work life balance	 Contractor	21 Feb 2023	5.0	Work-life balance, helpful colleagues, supportive management	none as of now... everything looks so good at Visa
8	overall good place to work	 Senior Data Scientist	18 Feb 2023	4.0	good work and life balance, flexible	too much internal politics, have to build relationships
9	Decent place but a lot of org changes and bureaucracy	 Manager	9 Feb 2023	4.0	Good benefits Good salary Generally nice people	Too much unnecessary collaboration Slow processes Bad go to market for new products
10	Nice	 Software Engineer	3 Feb 2023	4.0	Really friendly bosses and colleagues	Abit on the slow side in terms of work
11	A good working place in overall	 Software Test Engineer/QA Engineer	2 Feb 2023	5.0	- Provides with a good working culture (US based) - Flexibility on working hours (offer hybrid model, possibilities on working from home) - Proper annual evaluation systems ( clear goal and objectives) - Provided with highly competitive packages with lot benefits (Flex benefits, health insurances etc.)	- In some cases a bit of impractical work goals - High workload
12	Great	 Technical Writer	1 Feb 2023	4.0	Career growth, employee benefits, work life balance	Bureaucracy, high pressure, travel globally
13	Solid Company, Good benefits	 Sr Director, Technology	21 Jan 2023	4.0	Comprehensive benefits and a flexible work/life balance	'Too many chefs in the kitchen' - this is not a nimble startup.
14	Positive Outlook	 Senior Data Engineer	16 Jan 2023	5.0	Very good team with drive and passion Flexible people and helpful managers Good WORK-LIFE Balance	I don't have any cons on employee benefits, It's excellent for permanent employees but not for contractors
15	Stable, Big, Busy	 Staff Software Engineer	22 Dec 2022	2.0	"- Good & smart colleagues mostly 
- Good benefit 
- More or less stable company compared to other tech peers, although you still have the small chance of lay-off 
- It is good for your career if you don't mind sacrificing your personal time"	"- Poor work life balance- long hours & weekends: you sometimes have to work on weekends FULL DAY in some teams. Some big bosses also tend to romanticize working weekends. It also depends on team though. So, if you are lucky, you might land in a team with good work life balance 

- You are required to be on-call (24 hour standby) during peak periods even though you are L3 support! Again, some teams don't require that

- Some coworkers like to text the team during personal hours such as late night, weekends, etc... on WhatsApp. There seems to be a culture where you have to show you are hard-working to get that promotion! 

- Corporate wants to bring employees back to office 100% 

- Process heavy, old tech, you will get tied to very niche project with small scope and do the same thing throughout, while your knowledge getting outdated"
16	Review	 Software Engineer Intern	8 Dec 2022	5.0	Visa is a stable company and a good place if you are seeking that	Slow work environment and not the best engineering culture
17	Best Company in Payment Industry	 Senior Consultant	4 Dec 2022	5.0	ALL their benefits Latest technology stack	Nothing I can think of compared to other peers
18	Good	 Trainee	18 Nov 2022	5.0	Nice people Good training program Good opprtunities	Not much cons at the moment.
19	Rigid, Dinosaur processes. Brands themselves as a Tech company, but acts more like a bank.	 People Team	3 Nov 2022	1.0	People are generally nice on the surface level. Decent internal mobility opportunities.	Very top down driven. Elitist mindset found in most senior management and they really like to gossip. Old school legacies and don't like to innovate. Traditional and work is NOT flexible even if they say it is .Facetime is crucial during meetings / the day and you have to be at your desk. Change management is terrible, managers don't handle it well. they really squeeze you dry, and leave you to drown, then penalize you for it during performance reviews. Lots of people gossip and bootlick as well, this bit i found surprising as I had initially heard great things about Visa's culture so quite disappointed.
20	Good to work	 Anonymous Employee	28 Oct 2022	5.0	Work life balance Great work	Nothing as such, everything looks goos
21	Great company	 Director	25 Oct 2022	5.0	Salary Environment company profitability Stability	none as such, most employees are happy
22	Technical product manager	 Technical Product Manager	20 Oct 2022	4.0	Great work life balance Company	I can’t think of any at the moment
23	Great place to work	 Senior Systems Engineer	22 Sep 2022	5.0	"Great place to work.
Good work life balance."	Nothing nothing nothing nothing .........
24	Good culture	 Trainee	21 Sep 2022	5.0	Good culture, learning is encouraged, opinions are valued	pay not as competitive ..
25	One of the best companies in terms of corporate culture, especially for full time employees	 Software Engineer	20 Sep 2022	4.0	"Visa as an organisation places high emphasis on ethics which makes it an organization that employees can feel proud about working under. It offers benefits to the employees such as 20 hours of paid time off to volunteer, employee donation matching as well as 1 month of childcare leave. 

Visa strives to integrate work life harmony into its work culture and offers employees mental health and well being resources. Employees are also allowed to take Friday afternoons off if they have completed their tasks, during certain times of the year.

As the Return To Office initiative started once the COVID restrictions were lifted, the company staff organized more sessions in the office for employee engagement. Some of these include a Yoga session and a Bollywood jam session.

Hence, if you are looking to join a large company for the long run, then Visa is definitely one of the companies that you should look out for."	"These are applicable to contractors rather than to full time employees:
1. Contractors are not kept in the loop for some of the internal communications that full time employees are involved in
2. Contractors have to get additional permissions to access certain resources 

However, I think that these issues will be faced by contractors at other companies as well so that should not be a problem for those who go into the company knowing about them."
26	Good	 Senior Consultant	8 Sep 2022	5.0	Work life balance is there. Friendly colleagues	No cons as of now
27	-	 Intern	7 Sep 2022	5.0	Good working environment at Visa	No particular cons at Visa
28	Great culture, great people, amazing mobility across roles and geographies	 Business Analyst	1 Sep 2022	5.0	People are lovely, culture is immaculate, and there are amazing opportunities to move throughout the company	No cons I can think of
29	Visa needs tech. managers than people managers.	 	30 Aug 2022	3.0	"Good work life balance.
Good benefits."	"The company needs technical managers rather than just people managers when they are transitioning towards innovation and new ideas.
Insecure middle management does not allow technical members to grow or work in desired way.
People in the management take technical decisions without consulting technology staff which later proves disastrous.
Favoritism is a weakness for people in management for  which the company as a whole suffers."
30	Great Place to Work	 Senior Software Engineer	29 Aug 2022	4.0	It's honestly a great place to work with good benefits and a true care for its employees	Tech stacks are a bit dated, with an inertia to move towards newer ones. Business processes are cumbersome but expected with a company that needs to be very concerned about security. All in all not too bad honestly, just wish that pay were a little higher
31	Visa	 Software Engineer	10 Aug 2022	5.0	"Good work life balance
Good branding"	May have to work on older technologies for mainframe support
32	Great company! Unparalleled benefits!	 Lead Network Analyst	1 Aug 2022	5.0	Unparalleled and Flexible Employee benefits	Work load tends to be overwhelming but thanks to our team management👍
33	Good company	 Senior Financial Analyst	25 Jul 2022	5.0	Work and life balance, good benefits, management caring for employees	Recent aggressive hiring and Slower career development
34	Great, inclusive work culture	 Director	20 Jul 2022	5.0	"- Good work-life balance is promoted
- Inclusive work culture
- Strong promoter of career progress and internal mobility
- Decent compensation
- Goal oriented performance and reward structure"	"- Matrixed organization with usual large-company challenges of geographic vs. corporate goal challenges
- Not enough people/team management opportunities until Senior Director level given that Visa is a large Fortune500 company with relatively smaller workforce"
35	Singapore HR makes fun of employees	 Staff Engineer	20 Jul 2022	1.0	Good job security. flexible work culture. listening managers.	"Made fun of employees with Singapore HR settled for single digit hike when CEO announced ""significant"" hike.

HR doesn't know the growing inflation in Singapore. Need new HR team"
36	Very Humble and Fair Work Culture	 Senior Consultant	6 Jul 2022	5.0	Good to work for long term. Company gives more value for ethics and values	Diversity could be a bit challenge
37	Good but not quite	 Risk Analyst	27 Jun 2022	4.0	"A lot of things to learn
Great co-workers"	"Not good management
Tehy dont care about lower rank employees
All talk and promises"
38	Meh	 Data Analyst	15 Jun 2022	3.0	Good and best, sometimes understanding and sometimes not	Bad and worst, driven but difficult at times.
39	Best place to work	 Staff Systems Engineer	13 Jun 2022	5.0	"High value for employees
Work-life balance is amazing
Management is super transparent
You can learn whatever you want
Compensation and bonus are good as compare to market"	"Not all employees are getting chance to work on latest technology stack
Whatever you learned will be useful if you get a chance to implement it which rarely happens"
40	Employee friendly organisation	 Senior Director	6 Jun 2022	5.0	"- Thoughtful leadership
- Sensitive to Employee requirements
- Opportunities to grow for smart working employees"	"- Politics and unconscious biases
-Slow to act as being heavy on processes & procedures"
41	Rewards hard work over smart work	 Senior Engineer	31 May 2022	3.0	"Good work and infrastructure. Great team. Very good learning opportunity.
Great brand, great benefits, pay at the time of joining. Supports good work life balance. Market leader. Market differentiating businesses. Good growth if under a good leader who are exceptions but not normal."	"Lack of good new age processes and follows very old processes. 
Strong old culture with very old school thoughts who insist extended hours of work. 
Good work life balance at the high cost of slow career growth.
Culture that appreciates hard work over smart work and rewards hard workers more."
42	All is well	 Senior Software Engineer	29 May 2022	5.0	Really great place to work	Nothing to say about cons, all good
43	Love my team	 Software Engineer	6 May 2022	5.0	"Everyone is so helpful and easy to work with
Manager is great and really cares (but depends on luck)
No politics internally and team tries to be open and transparent 
Health insurance and dental coverage is pretty good for employee and family 
20 days leave and goes to 25 once 5 years in co
10 days family emergency leave"	"Too many security and compliance to adhere by thus keeping engineers very busy with them 
HR does not seem to be helping much with retention
Salary needs to be improved for those that stayed and has the knowledge"
44	Great Place to Work	 Lead Recruitment Co Coordinator	29 Apr 2022	5.0	Great brand, great benefits, growth, pay	Can get monotonous, long working hours
45	Good place to work	 QA Automation Engineer	18 Apr 2022	4.0	"Good place to work
Good work life environment
Flexible working hours"	Technically , you won't be able to explore much if you are working as a contractor.
46	Very good culture and balance of work	 Senior Software Engineer	15 Apr 2022	5.0	Amazing balance of workload and personal life. Supportive crew as well.	None that I can think of.
47	Supportive, inclusive, open	 Business Associate	11 Apr 2022	5.0	"- Collaborative and supportive culture
- Flat and lean org
- Excellent work-life balance"	- Global-Regional-Local hierarchy causes bottlenecking at times
48	Awesome place to work	 Senior Software Engineer	29 Mar 2022	5.0	"Career Growth opportunities. Good pay scale. Employee Friendly, Leave policies,
Innovative people"	Nothing observed. Depends on team you are part of
49	Good company	 Senior Software Engineer	15 Mar 2022	4.0	Respect to the employees. Nice management.	Low salaries as compared to other financial institutions and competitors like Mastercard and American Express
50	Great Company to work with	 Director	5 Mar 2022	5.0	Well structure and employee are well respected	Be more innovative and willing to change
51	Working enviroment	 Associate Tech Support Analyst	2 Mar 2022	4.0	Dynamic and friendly working environment	Work from office is mandatory for some
52	Good	 Software Engineer	1 Mar 2022	4.0	Nice environment and work life balance	Not too competitive compared with other companies
53	great, i love my company	 Finance Manager	23 Feb 2022	5.0	internal mobility, safe culture, great people	slow opportunities, nothing much to say, it is a good company
54	Good experience but very less visibility in organization to contractors.	 Software Developer	23 Feb 2022	3.0	"Work life balance.
Friday Mania where you get some snacks to eat."	"Not that great work, targets permanent employee only.
Contract was broken as soon as corona was hit.

Contractors working on hire and fire basis."
55	Life@Visa	 Senior Software Engineer	22 Feb 2022	2.0	Work life balance is good.	Low salaries as compared to the tech peers. Too many legacy system.
56	Good company	 Data Scientist	17 Feb 2022	5.0	Work life balance is good	No bad things to say
57	Great company	 Director	16 Feb 2022	5.0	"Good work life balance
Good place to work"	No cons at my workplace
58	Good pay !	 Software Engineer(Internship)	11 Feb 2022	5.0	A lot of hard and interesting work	Too many indians haha, not sure if indians are highly favoured for promotion?
59	Its a decent company	 Senior Software Engineer	27 Jan 2022	4.0	Opportunities are vast and you are allowed to explore any opportunity of your choice	HR policies sometimes are painful
60	Great company	 Business Associate	23 Jan 2022	4.0	Strong managerial focus on the graduate program	Lack of international exposure on grad program
61	Falling Behind in Technology Space	 Senior Software Engineer	12 Jan 2022	2.0	"Work Life Balance (based on teams as well)
Good Learning Culture
Managers are encouraged to be empathetic and understanding"	"Falling way behind in compensation in Singapore (and many other countries to be honest). HR and management is adamant that they are paying a competitive compensation.

There are also many double standards. In the year where employees got a pay freeze, senior execs continue to have their double digit percentage increment. This is an irony because one of Visa's leadership principle is ""Leading by Example"".

There is many opportunities to achieve great things in Visa as there are many talented engineers if Visa makes an effort to retain them. On the other hand, Visa has to be more firm to remove engineers who have proven to be not up to standards."
62	Good company	 Senior Software Engineer	5 Jan 2022	3.0	"Good company 
Great learning
Good benefit"	"Slow growth
Not good in terms of compensation"
63	Company is good	 Senior Developer	28 Dec 2021	4.0	"Good work life balance
Good learning and decent pay."	HR department is very incompetent. Not ready to listen to employees problems.
64	Little Technology Integration and Empowerment	 Director	27 Dec 2021	3.0	"Reasonable compensation and benefits
Regional exposure"	"Leaders gave little time or listening ears on encouraging employees to express ideas
No empowerment to implement changes at the regional level
Top-down communicaiton"
65	Good Company but no longterm scope for Contractors	 Senior Consultant	23 Dec 2021	4.0	Work life Balance is good and company gives lots of space for learning	No long term work and company can terminate contract even in a running project
66	Good company to be in.	 Associate Analyst	20 Dec 2021	4.0	Good benefits. Diverse team dynamics.	No cons at the moment
67	Slower in implementation, forgets experienced	 Senior Consultant	2 Dec 2021	3.0	The job is challenging definitely, shifting strategies to latest technologies and pay is moderate	"- Too much of process to get your work done
- New College Grads are more paid than the experienced people, not the same importance given to retain existing employees
- Sudden changes / additions in role hierarchy without any discussion with employees"
68	Great experience working at Visa	 Anonymous Employee	25 Nov 2021	5.0	"Open culture
Autonomy to run projects, ideas"	Internal mobility is not as easy as is portrayed
69	Get the right salary and designation	 Senior Systems Engineer	19 Nov 2021	4.0	Very helpful people and can play around with any latest technology you want. Good learning opportunity to improve skills and can suggest ideas, improvements, do innovations. Good work life balance and year end bonus etc.	Get the right salary while entering in to the company. Specially if you are hired from other countries than the designated work location, you will be paid 50% less when compared to the market and even you will be given less role/designation. So do ground work and know where you stand and demand the package accordingly because getting decent hike here is like seeing shooting star.
70	good	 Analyst	12 Nov 2021	5.0	good work environment. good process.	nothing that i noted so far
71	Amazing place to work	 Anonymous Employee	11 Nov 2021	5.0	"Work life balance
Compensation
Value for employees"	"Management driven
HRs are not supportive"
72	Good	 Manager	10 Nov 2021	4.0	Good company culture, nice supportive environment	it is very competitive among coworkers.
73	Amazing company for developers	 Manager	6 Nov 2021	5.0	"Open culture, everyone is respected.
Managers are given training to be understanding and empathetic thus good managers mostly.
Good benefits (medical, dental, 20 days leave - 25 days after 5 years, stocks etc)
Company tries as much as possible to give WLB
Lots of training available on intranet"	Difficult to be a manager as engineers are treat very very well and tend to take things for granted.
74	Good company with bad management and HR	 Staff Software Engineer	27 Oct 2021	2.0	"Pay and brand
stable company
annual bonus"	"no promotion
no growth opportunities
internal movement not possible
compensation is ok but not competitive
HR is for namsake and less co-operative
not a good company for freshers and talented people"
75	Great	 Project Manager	25 Oct 2021	5.0	Great working with visa and always	No issues. All good working
76	Good	 Sales Manager	20 Oct 2021	5.0	Flexible work hours and great visiblity	Not anything as of now
77	Visa inc	 Systems Analyst	10 Oct 2021	4.0	"Good paymaster.
Good benefits like health insurance etc.."	Recognition of the employee work by manager -need to improve
78	Every day is a day to learn something new and then it evolves. There is never a boring day at Visa.	 Visa Rules Management Compliance APCEMEA	10 Oct 2021	5.0	There is an ever growing stream of information and learnings you can get from working here. There is never a boring day except when the laptop or applications fail.	It maybe a little overwhelming for those who don't like being challenged daily.
79	Good for retirement, not for growing your career	 Senior Software Engineer	21 Sep 2021	3.0	"- Friendly colleagues and working environment
- Good CEO 
- Strong emphasis on work-life balance
- Friday well-being hours & annual leaves
- Good medical and flexi benefits
- Visa university is great (paid online courses that employees have free access)"	"- top down management. Decisions are taken from US office and Singapore just implements them
- below average compensation compared to the market
- lack of opportunities to grow in career
- uninteresting work
- engineering quality is poor
- tech stack is uninteresting
- lack of innovation
- too much bureaucracy
- managers & directors don't have engineering experience but they lead engineers
- high attrition rate on young engineers"
80	Great company to work for.	 Staff Software Engineer	15 Sep 2021	5.0	VISA aims to be a good employer and it certainly is a delightful experience working there. Decent compensation, workload and benefits. Nothing over the top but decent.	Can be a bit boring work.
81	Work life balance, teamwork, lot of resources to learn & growth	 Director	15 Sep 2021	4.0	"Work life balance
Good Teamwork
Plenty of internal online resources to learn & growth"	"Pay compression happen for long service staff
Maintaining efficiency is a pain while too many internal process and decentralized work tasks managed by different team in different time zone & location"
82	Great work environment	 Software Engineer	2 Sep 2021	4.0	"- Work life balance
- Many learning resources
- Professional work culture
- Using latest tech"	Corporate overhead work may impede development process
83	Useless	 Senior Consultant	31 Aug 2021	1.0	The Brand Name is good.	Not good to work since lots of politics
84	Great company culture	 Account Manager	28 Aug 2021	5.0	"- Encourage new initatives, making mistakes is ok
- Compassionate and helpful colleagues"	- Compensation can be better
85	Nice place to work	 Senior Systems Analyst	28 Aug 2021	4.0	Company is recognizing each employee	But Internal management is not recognizing the right people and not allowing to grow.
86	Amazing place to work at	 Software Engineer Intern	27 Aug 2021	5.0	The work culture there places a strong emphasis on work-life balance. The people at Visa are very helpful, always willing to lend a helping hand whenever I had questions pertaining to my tasks. At the same time, they make efforts to engage me on non-work related matters, such as holding informal online chats.	Sometimes the senior staff may be too busy to reply promptly. Some parts of the technical documentation do not contain enough relevant information.
87	Think twice before joining	 Office Administrator	26 Aug 2021	1.0	Benefits are very good and some local colleagues	Get treated badly if you are not white or a low level support.
88	Family-orientated. Supportive for your career development. Highly ethical.	 Director	18 Aug 2021	5.0	Very friendly and flat Organization. The employer values your family life and diversity & Inclusion. They are also supportive for your career development including relocation and shifting functions. Generous benefit plans including competitive salary.	I cannot think of any.
89	Visa	 Business Associate	1 Aug 2021	4.0	Visa has pretty good work life balance, benefits are also great. They are very big on internal mobility and will give opportunities for internal staff to move	Reorganizations might be common especially in the Hub teams. However, company is relatively transparent with the processes and navigating employees through it
90	Visa Worldwide	 Senior Director	23 Jul 2021	5.0	Great employee focussed work culture	Very hierarchical country/regional management structure
91	Work life balance with good team	 Software Engineer	18 Jul 2021	5.0	good work life balance with interesting work and good culture	Information sillos and manual processes
92	Good culture	 Software Engineer	7 Jul 2021	5.0	Great working culture, people are understanding. Good work life balance.	Nothing that I can think of.
93	Good company to work at.	 Senior Software Engineer	6 Jul 2021	5.0	Good benefits and relaxed culture	Stiff Hierarchy and it's difficult to talk to upper management even though they conduct skip level meetings.
94	value diversity	 Anonymous Employee	5 Jul 2021	5.0	do quite well in the D&I	not much good growth oppty
