	Summary	Job Title	Date	Overall Rating	Pros	Cons
198	Good company with huge potential to grow	 Senior Software Engineer	11 Feb 2020	3.0	"Competitive salary and very good perks way above market standards.
Excellent work life balance.
Huge company with almost all the skillsets and technologies that you want to work on.
They are working hard at the top level to be in the competitive market and continuously working to work on some cool products based on changing consumer market."	"Management level politics. Especially with Indian managers at the top position. The positions are filled with preferential candidate even before they are open to other internal candidates/ general public  for a competition.

If the funds allocated to to each team could be used in a better way would be more benifitial.

Its difficult to get to next level, as there goes a lot of politics and favouritism behind promotions as well and even though the company has a good policy to support internal mobility, the hiring managers know how to exploit that option and in the end it turns out to be a tool exploited by hiring manager to get someone they like."
199	Sr. Analyst	 Senior Business Analyst	21 Jan 2020	5.0	Visa provides you with international business experience regardless of the team you work for. It's a very open company culture with an increased focus on eliminating silos across business functions.	At a large company, you're bound to encounter some silos. However, it's only top of mind for me because Visa management so openly discusses changing that.
200	Cool internship	 Intern	2 Jan 2020	4.0	Cool benefits And really diverse company	Nothing at the moment
201	Lead software delivery engineer	 Anonymous Employee	13 Dec 2019	5.0	Carrier growth, benefits, work life balance	Nothing as such for now
202	Relevant, Senior, Experienced	 Anonymous Employee	10 Dec 2019	3.0	Good benefits and good welfare. Focused on growth and being the market leader.	Lack of job security, company does not address major concerns of employees, to many restructuring that results in many job cuts and staff displaced.
203	.Net Developer	 Anonymous Contractor	4 Dec 2019	4.0	work life balance is excellent	As per me nothing major
204	Senior Software Engineer	 Senior Software Engineer	29 Nov 2019	4.0	Best benefits; Chances to learn	Managers are unfair or bias sometimes
205	Great place!	 Senior Director	21 Nov 2019	4.0	Good environment. Great team. Good work life balance.	sometimes lazy. Takes things for granted.
206	Software Engineer Internship	 Software Engineer Intern	18 Nov 2019	5.0	Great experience with the company, proper internship program with opportunity to work on ongoing projects.	Some projects require coordination with overseas team, meaning having to stay up or work early
207	+ and -	 Anonymous Employee	12 Nov 2019	3.0	Benefits, compensation and working relationship with peers	2nd level managers are setting up fiefdoms and are not in tune with what is going on in the grounds.
208	Senior Staff Software Engineer	 Staff Software Engineer	23 Oct 2019	4.0	Great people with lot of knowledge	Very much agile and a lot of learning curve
209	Software Engineering Intern	 Anonymous Intern	23 Oct 2019	5.0	Helpful colleagues, Leaders that care, HR that makes effort to know interns	Diversity may be lacking. Office can be more vibrant
210	Internship Review	 Intern	21 Oct 2019	5.0	Very open staff that are very willing to help	Not that i can think of, enjoyed my time there
211	Visa Singapore - Tech employee review	 Anonymous Employee	18 Oct 2019	4.0	"1. Good brand name
2. Median salary
3. Flexibility on time, work from home
4. Access to latest technology and training"	"No work life balance, tremendous work pressure.
Managers have great authority, so if you are lucky with a good manager, you will enjoy life at Visa. But if you are work with a bad manager your life is hell and no support from HR."
212	Great Intern experience	 Summer Intern	7 Oct 2019	5.0	"Above average intern pay
Good program"	Nothing much really, big company so theres more processes to get used to.
213	Management should be more mature	 Senior Software Engineer	30 Sep 2019	3.0	"- Good work life balance
- Good pay"	"- Mostly in SG people are either contingent workers got converted or people from Banks, hence they have very limited engineering experiences to solve complex problems
- Management is quite slow in making technology decisions
- Seniors expect to give them respect though we juniors tend to be more technically mature
- Corporate politics with very biased nationality presence"
214	Best Intern Experience	 Anonymous Intern	21 Sep 2019	5.0	People here are open minded and friendly. All my coworkers are helpful in helping me with tasks or in areas I had little to no knowledge in. They treat me more than an intern and always invited me to sit in for high-level meetings which sometimes I feel a little out of place but I really appreciate it.	My not-so-good experience came from certain individuals which doesn't really matter. Also, I was unable to extend my internship from 6 months to 9 months because of some 'policy' which I believe it's just from the HR side. Intern pay is lower than the other companies I have interview for too.
215	Software Engineer Intern	 Senior Software Engineer	14 Sep 2019	4.0	"Not much burden, easy to implement.
Team env is good."	"Boring, too easy, not much impact. 
CICD pipeline is incomplete."
216	Diversity & Inclusion	 VP1	30 Aug 2019	1.0	"Good Internal mobility practices and pay scale that is fairly competitive for most roles. 
Making efforts to tap into non traditional segments within payments."	D&I is about events, PR, photos , linkedin posts and publicity. They do a great job packaging and telling people what to do. Fabulous way of integrating folks into the company! Inauthentic leadership and top management. Agree with a bunch of my fellow colleagues - Australians , Blond/e  rule this place.  If you don't match these categories Mastercard may be a good bet. Current HR team cannot be trusted - one of the worst and most political functions within Visa.
217	QA Engineer - Automation tester	 QA Engineer	29 Aug 2019	4.0	"-amenities
-well connected to the mrt
-quality work 
-good work-life balance"	-lesser salary when on contract
218	Simply dont care	 Manager	2 Aug 2019	1.0	Good salary and work life balance (this is because no one care about work)	No transparency and ineffective management
219	Best in Class	 Project Manager	21 Jun 2019	5.0	Focused and helpful team members.	Processing to hire is very slow process
220	One of the best company to work for.	 Staff Engineer	28 Apr 2019	5.0	"1.Lots of exposure to different facet of payment
2. Variety of project towork for.
3. Good salary, employee friendly."	"1. Work life balance is a challenge at tlimes.
2."
221	Sr Systems Analyst	 Senior Systems Analyst	11 Apr 2019	4.0	Latest tech trainings and lot of recreational clubs	The rate of promotion is slow
222	Regional HR practices in AP.	 Sales Manager	6 Apr 2019	2.0	Visa global brand Global CEO	HR policy strictly disallow double promotion. But there is inconsistency in practices. Another senior regional HRBP discredited other candidates for a person she referred during the screening process.
223	Freedom to work	 Senior Software Engineer	3 Apr 2019	4.0	"- No one limits you on your ideas
- Since everyone is learning, good place to try different roles
- Great work life balance"	"- Lots of Indians across the company which creates difficult in change of thought process
- Politics are as usual expected in big companies
- No one is an expert in their domain so friction in some discussions"
224	Consistent Company that Seeks to Keep Pace with Change	 Director	1 Apr 2019	4.0	"- Inner Mobility 
- Cultivates Talent
- Flat Organization
- Smart, Kind, Challenging Leadership
- Values-oriented
- Good Overall Mission
- Excellent Benefits 
- Collaborative + Collegiality"	"- Leadership does not clearly articulate strategic priorities for the company to follow 
- Needs to strike a better balance between empowering local markets and driving a clear vision that they can properly execute
- Diversity on board (mostly U.S.-Centric, which shows in how our competitors are out-pacing us around the world) 
- Though well-intended, would benefit from a President with more technology and international experience ... need more bold thinking and focus
- Huge disparity between how titles are awarded in the U.S. and elsewhere in the world. There are Vice Presidents and Senior Directors working on presentations and operational issues in SF versus Directors charged with P&L for business units across an entire sub-region. Would benefit from FEWER title levels at mid to senior management  thus allowing for mobility through payscale (e.g. Manager, Director, VP, EVP - done)"
225	Easy Job No Pressure	 Anonymous Employee	20 Feb 2019	3.0	"1. Easy Job 
2. No Pressure
3. Work Life Balance is Good"	"1. Too many Indian
2. Promotion is too slow."
226	Sr System Analyst	 Senior Systems Analyst	20 Feb 2019	5.0	Company provides good benefits to  its employees and the working environment is good.  You can build your personnel development as the company supports training .	It is very hard to move up in the Career as the efforts are not much recognized. you need to be in good books for any kind of appreciation.
227	good company but bad place to do coding.	 Software Engineer	5 Feb 2019	4.0	"- The team I am in has some of the best people Ive ever worked with. Great team dynamics. (partly thanks to the good manager)
- good w/l balance, good benefit, flexible hours."	"There are many good things about this company, but if you want people to believe visa as a good tech comapny, there left so much to be desired.

The overall engineering culture sucks. Code quality is generally bad, engineering process and internal tools are old. But worst of all, a lot of engineers don't bother to make better efforts, leaving holes that later come back to bite others in the butt."
228	Great culture, good pay, great vision	 Senior Director	16 Jan 2019	5.0	Strong culture, switched on senior executives, good work life balance, great diversity and inclusion focus	Collaboration between business units needs to improve
229	White Boys Rules in Apac office	 Anonymous Employee	15 Jan 2019	3.0	Mainly Australians in management. if you are a white boy, fab company.	Most Asians are not invited to the table of influence. Asian Women in Apac office are extremely rare seen in senior management positions. They run diversity discussion to address the issue but it starts with the management comfortable working with their own boys club.
230	Work life	 Software Engineer	11 Jan 2019	5.0	"Great work-life balance
Flat organization chart
Easy to grow
Great benefits"	Lots of internal politics inside the teams
231	Visa Internship	 Software Engineer(Internship)	9 Dec 2018	5.0	"- Great company culture and working environment
- Various activities
- A company caring for its employees"	No any countable cons really
232	Software development engineer	 Staff Software Engineer	9 Dec 2018	5.0	"1. Great work culture
2. Great leadership team
3. Interesting , challenging work
4. Flexible work time 
5. No politics"	"1. Location constraints & strategy
2. Slow hiring process"
233	Visa	 Intern	1 Nov 2018	5.0	Big company, many opportunities	Big company,a little difficult to adapt
234	Excellent experience for an Internship	 Intern	25 Oct 2018	4.0	"- Flexible working hours
- Autonomy to experiment and work on open source technologies
- The company invests heavily in your learning and development such as having Visa University
- Business trip  to San Francisco, the USA for an internship summit
-  Good culture with very friendly people"	"- Due to different locations and timezone, you might be required to come in early to attend meetings from time to time
- Non-competitive salary offered for the graduate role as compared to other tech companies of the same size
- Other than these, Visa is a really great place to work"
235	A giant with very old mineset	 Senior S/W Engineer	15 Oct 2018	2.0	Work-life balance and benefits are good.	Not inclusive as they claim to be. Bias and politics. Most of the time the difficulties are not coming from the work itself. Everyday work there is kind of boring. Some people just sit there and wait for their paychecks.
236	A good place to work	 Anonymous Employee	5 Oct 2018	4.0	Good employee benefits, a culture that encourages learning, good work/life balance	Needs to have fairer pay scale.
237	Good place to learn and grow	 Senior Software Engineer	12 Sep 2018	5.0	As mentioned in the title, i learnt a lot. Very flat hierarchy	Office politics affects day to day productivity
238	Good company with excellent work life balance	 Software Engineer	28 Jul 2018	5.0	"Long holidays, excellent work life balance
Big office
Nice structured program
holistic experience in the industry"	Salary below the industry average
239	Good company name value only	 Anonymous Employee	15 Jul 2018	2.0	"- Good company name value
- Good work-life balance
- Good benefits (medical/personal leave, medical benefits)
- Very motivated, hardworking CEO and President"	"- It is a US company but run like an Asian company with Asian values. It's a pity because globally the company works really hard to maintain and live up to its value.
- Employees do not leave (most of the managers have been here over 10 years and don't plan on leaving, ever) 
- Difficult to survive if not involved in office politics
- Overall pool of employees are older generation (no entry-level)
- Resistant to change
- Any complaints or reports are not dealt with properly. Employees are told to voice out their concerns and when they do they are told to keep quiet and 'let things pass without stirring the team'. Saw this happening before I left, feel bad for the team who have to deal with it when everyone already knows."
240	White boys (and girls) club	 Anonymous Employee	21 Jun 2018	2.0	Amazing brand, good employee-focused culture, modernizing (ableist slowly), small enough company to feel that family spirit	"A really white-centric company, especially in AP Hub. 

As others reviews have said, being non-white / westernized immediately discounts your perception as a leader. 

They keep trying to act like diversity is a big focus and avoid the ethnic diversity question by making it all about gender diversity. 

They keep saying they’re making efforts on ethnic diversity but it’s nothing really. The latest wave of restructuring has only reinforced the white dominance at every layer of management. 


Guess what, gender diversity is not your biggest problem, ethnic diversity in leadership roles is. And you’re doing nothing about it.

Virtually al leadership teams in AP hub are mostly white. All ‘working teams’ as they condescendingly put it are mostly Asian. No space for Asians in
mid management or above. It’s really sad, like reliving what our ancestors went through during colonial times. 

Do you really expect us to believe that there is no real leadership talent available in all of Asia Pacific minus ANZ (the most populous region on earth), including the thousands of Asians already working at Visa? Are they all missing that special something? 

Or is it more likely that the talent is there, it’s just that your white bias makes you discount it?"
241	Digital Service Specialist	 Anonymous Employee	9 Jun 2018	4.0	Balanced work-life, Respect from peer colleague and senior management, encouragement of joining extra-curricular activities to contribute to the society, flexi credits, company stocks subscription	Will be better if higher promotion opportunity
242	Visa Singapore - Great place if you are good team	 Staff Software Engineer	16 Apr 2018	4.0	"- Best perks in industry
- very supportive team amd management
- chance to work with new technology stack 
- great team culture (depends on team)"	"- since a lot of old employees so they try to create dependency upon themselves and very seldom share there knowledge
- Teams have grown 5-8 folds in last 3 years, so growth opportunities have become limited as they have mentality of promoting people by numbers(max 3 per team etc etc) instead of looking if the people in question are already performing at next level at the work.
- Very slow to accept change
- business driven not technology driven."
243	Great place to work... if you're white	 Anonymous Employee	13 Mar 2018	3.0	"Increasingly hiring better talent, younger people, and starting to modernise
Rare example of genuine cultural transformation towards digital (design thinking, innovation, #getdigital etc.)
Great comp and bonuses
Stock is galloping
Internal mobility"	"1. There's a huge bias (subconscious or concious) that only caucasians can make good leader.

In AP Hub, few locals/Asians make it beyond SD whereas white folks with little industry experience get VP in their early 30s.

Some teams have literally all-white leadership teams with legions of Asians working under them. Ironically this is the ASIA business. When a white leader leave, they hire another (or one of the other white lead takes on the leaving person's territory). 

Sure APLT has a few token locals and Indians but those too are far outnumbered and the heavily westernised types.

Who can you complain about this? Your Aussie recruiter? Or the Aussie HR? Or the same thing up the command chain.

2. Constant restructuring and lots of childish politics at SVP levels"
244	Stable company with good benifits	 Information Systems Engineer	1 Jan 2018	4.0	"Innovative 
Great benefit
Dynamic environment, fast pace, technology keeps on changing and best place to learn new things"	"High rate of politics that push great employees to leave
Less Work life balance"
245	Good stable company with good benefits	 Senior Customer Service Representative	28 Nov 2017	5.0	"had to work in amazing international team
good benefits incl various allowances, health check etc."	slow and difficult promotion process
246	something	 Senior Account Manager	19 Nov 2017	5.0	Good Pay. Average Bonus.	nothing so far. not noticed
247	Staff Software Enginner	 Staff Software Engineer	26 Oct 2017	5.0	"Good work place.
Decent work life balance.
Salary on par with Other organisation.
Along with work many good clubs within organisation for personal growth.
One of the best organisation i worked with and would love to join back i if ever get a chance."	Heard few  people face issues  because of not being under good management.  I was lucky to be under good managers so cant' comment on that.
248	Ok compensation but expect no growth.	 Senior Software Engineer	26 Oct 2017	3.0	"VISA provides competitive salary for relevant experience
The Benefits and compensation are good
The Work-life balance here is also good"	"No professional growth
To much lobbying by incompetent managers
Not worthy people in mid & upper management
Raising concerns may backfire"
249	Great brand offset by poor leaders	 Senior Finance Manager	19 Oct 2017	2.0	Ethical and trusted brand to work for.  New CEO wants to make a difference in people management practices, but it takes time to undo entrenched mindsets of leaders.	Sycophancy, diversity of thought only in decks, new leadership principles ineffective due to siloed function leaders unwilling to change in spirit.
250	Great organisation	 Staff QA Engineer	30 Sep 2017	5.0	"Its a great company to work for.
Take care of the Employee's interest.
Good in terms of compensation.
Works on cutting edge technology"	"Aggressive work schedule.
Work life is a delicate balance"
251	Best Company to Work	 Anonymous Employee	24 Sep 2017	5.0	"Decent Pay
Good Projects
Very Good Work life balance"	Some projects may be legacy projects
252	Too much politics, no work life balance	 Anonymous Employee	18 Aug 2017	2.0	It is a company that you will be able to learn a lot in experience. Good remuneration compared to other companies in Singapore	There is too much politics here which makes it really hard for employees to do their job. The Senior Directors and up all care about themselves and save their positions. There is too much chaos and too any reorg. The employees are treated like slaves or robots that
253	Overall a good company though cold	 Anonymous Employee	4 Aug 2017	4.0	Company looks after staff, flexi time, plenty of training available & work-life balance.	"- Too many long serving employees who are resistance to changes.
- The company is not open to suggestions though they promote diversity 
- HR has lots of room for improvement - solve your own problem if you have. 
- Same as other MNCs, promotion/transfer is allowed based on connection"
254	Software eng	 Software	15 Jul 2017	4.0	Good working environment. Learn lot	Late night work hurts lot
255	Software/Data Engineer at Singapore	 Software/Data Engineer	10 Jul 2017	5.0	"Really like the mentorship
People are very friendly
Bosses are very helpful
There are meaningful impacts of what Visa is doing
You can have opportunities for work life balance - like sports club and comm services."	Departments work in silos. So sometimes you need to actively reach out to people and ask what they are doing.
256	Good Brand !!	 Director	12 Jun 2017	3.0	"Industry leader
good exposure to payments"	"highly inefficient
more talk less execution"
257	Poor quality of software development	 Software Engineer	29 May 2017	3.0	- benefits are quite good	- software development quality is very bad
258	High performance and great place to work - if you have the right manager and in the right function	 Business Executive	12 May 2017	5.0	Above market comp and benefits. Mostly good working environment. Work life integration is commendable.	"Cross functional movement - even lateral - isn't easy. Still top heavy and red tape, despite the ""tech"" pace and culture it tries to sell everyone."
259	Company is trying so hard to reinvent itself	 Staff Software Engineer	6 May 2017	4.0	"Benefit is pretty good
work life balance is good"	"individual culture is not respected by others
Senior management just focused on politics
non-transparent culture where important decision is communicated within the inner circle. 
transferring between teams is a painful process
No process is enforced ."
260	Project Manager	 Project Manager	18 Apr 2017	3.0	Great exposure, Marker dominant and Leader, Advance Technology and product, their every single action and movement seems to be a new potential opportunities	Political, US centric thinker, Proud, Lack of team collaboration among US HQ with regional and country team, professional but no team work
261	NA	 Senior QA Engineer	6 Apr 2017	2.0	This is a big company and provides good benefits for all employees. Working hours are flexible but depend on team.	Process are complicated, not easy to integrate all modules. There are many documents, but they are not organized well, thus newcomers find that lack of information.
262	Great company, very focused on innovation and change internally and externally.	 Senior Director	1 Apr 2017	5.0	Committee to change, great leadership team, huge focus on innovation and the future of payments, dynamic and exciting workplace, great benefits	Some legacy processes and rules / procedures, which current management is committed to changing. Understaffed in some areas, but that also creates opportunity for broader job scope and opportunity to really make an impact in your role.
263	VP	 Vice President	18 Mar 2017	4.0	Open minded to help build creative solutions	Silo management structure too restrictive to breed crossed department sharing.
264	Client Relationship Manager	 Client Relationship Manager	13 Mar 2017	2.0	Great brand, other than branding, there is nothing else.	Identity crisis.  Visa positions itself as technology company, but deep inside it is a financial service company.  Technology and innovation are just marketing slogans.  The company is struggling for change but there is not much room for that.   Senior management doesn’t truly understand technology and how does it drives consumer behavior.
265	Large company trying to reinvent itself	 Manager	10 Mar 2017	4.0	Brand, work life balance, innovative	Frequent restructuring, budget cuts, headcount freeze
266	Quite good working environment	 QA Engineer	5 Mar 2017	4.0	Working in Visa is generally a good experience. The company offers good pay, employee benefit and training opportunities. We have gym, classes and various events here.	The culture and structure in Visa is not diversified enough. Employees tend to refer their relatives and friends to the same team.
